name,sci_name,common_names,family,image_url,aspca_url,non_toxicity_cats,non_toxicity_dogs,non_toxicity_horses,clinical_signs
Polystichum Falcatum,Cyrtomium falcatum,Fishtail Fern,Polypodaceae,https://www.aspca.org/sites/default/files/styles/medium_image_300x200/public/field/image/plants/fish-tail-fern-r.jpg?itok=8-9RC82C,https://www.aspca.org//pet-care/animal-poison-control/toxic-and-non-toxic-plants/polystichum-falcatum,TRUE,TRUE,FALSE,null
Ponderosa Pine,Pinus ponderosa,"Blackjack Pine, Western Yellow Pine, Yellow Pine, Bull Pine",Pinaceae,https://www.aspca.org/sites/default/files/styles/medium_image_300x200/public/field/image/plants/ponderosa-pine-1-r.jpg?itok=itqNiOOp,https://www.aspca.org//pet-care/animal-poison-control/toxic-and-non-toxic-plants/ponderosa-pine,FALSE,FALSE,FALSE,Cattle: premature birth of calves or miscarriage have been reported in cattle.
Pony Tail,Beaucarnea recurvata,"Elephant-Foot Tree, Pony Tail Plant, Bottle Palm",Agavaceae,https://www.aspca.org/sites/default/files/styles/medium_image_300x200/public/default_images/imageunavailable_0.jpg?itok=JCCt_uvE,https://www.aspca.org//pet-care/animal-poison-control/toxic-and-non-toxic-plants/pony-tail,TRUE,TRUE,TRUE,null
Porcelain Flower,Hoya carnosa 'krinkle kurl',Hindu Rope Plant,Asclepiadaceae,https://www.aspca.org/sites/default/files/styles/medium_image_300x200/public/field/image/plants/hindu-rope-plant-r.jpg?itok=bE9P8V4i,https://www.aspca.org//pet-care/animal-poison-control/toxic-and-non-toxic-plants/porcelain-flower,TRUE,TRUE,FALSE,null
Portulaca,Portulaca oleracea,"Wild Portulaca, Rock Moss, Purslane, Pigwee, Pusley, Moss Rose",Portulacaceae,https://www.aspca.org/sites/default/files/styles/medium_image_300x200/public/field/image/plants/moss-rose-r.jpg?itok=w2LbptFk,https://www.aspca.org//pet-care/animal-poison-control/toxic-and-non-toxic-plants/portulaca,FALSE,FALSE,FALSE,"Muscle weakness, depression, diarrhea"
Pot Marigold,Calendula officinalis,"Marigold, Mary Bud, Gold bloom",Compositae,https://www.aspca.org/sites/default/files/styles/medium_image_300x200/public/default_images/imageunavailable_0.jpg?itok=JCCt_uvE,https://www.aspca.org//pet-care/animal-poison-control/toxic-and-non-toxic-plants/pot-marigold,TRUE,TRUE,FALSE,null
Pothos,Epipremnum aureum,"Golden Pothos, Devil's Ivy, Taro Vine, Ivy Arum",Araceae,https://www.aspca.org/sites/default/files/styles/medium_image_300x200/public/devils-ivy-1-r.jpg?itok=PfK285jN,https://www.aspca.org//pet-care/animal-poison-control/toxic-and-non-toxic-plants/pothos,FALSE,FALSE,FALSE,"Oral irritation, intense burning and irritation of mouth, tongue and lips, excessive drooling, vomiting, difficulty swallowing."
Prairie Lily,Zephyranthes drummondii,"giant rain lily, hill country rain lily",Amaryllidaceae,https://www.aspca.org/sites/default/files/styles/medium_image_300x200/public/default_images/imageunavailable_0.jpg?itok=JCCt_uvE,https://www.aspca.org//pet-care/animal-poison-control/toxic-and-non-toxic-plants/prairie-lily,TRUE,TRUE,FALSE,null
Prairie Snowball,Abronia fragrans,"sand verbena, wild lantana",,https://www.aspca.org/sites/default/files/styles/medium_image_300x200/public/default_images/imageunavailable_0.jpg?itok=JCCt_uvE,https://www.aspca.org//pet-care/animal-poison-control/toxic-and-non-toxic-plants/prairie-snowball,TRUE,TRUE,TRUE,null
Prayer Bean,Abrus precatorius,"Rosary Pea, Buddhist rosary bead, Indian Bead, Indian Licorice, Love Bean, Lucky Bean, Seminole Bead, Weather Plant",Leguminosae,https://www.aspca.org/sites/default/files/styles/medium_image_300x200/public/field/image/plants/precatory-bean-r.jpg?itok=0TUt1pvz,https://www.aspca.org//pet-care/animal-poison-control/toxic-and-non-toxic-plants/prayer-bean,FALSE,FALSE,FALSE,"Severe vomiting and diarrhea (sometimes bloody), tremors, high heart rate, fever, shock, death. Seeds are very toxic (seed coat must be broken)."
Prayer Plant,Calathea insignis,Maranta,Marantaceae,https://www.aspca.org/sites/default/files/styles/medium_image_300x200/public/default_images/imageunavailable_0.jpg?itok=JCCt_uvE,https://www.aspca.org//pet-care/animal-poison-control/toxic-and-non-toxic-plants/prayer-plant,TRUE,TRUE,FALSE,null
Precatory Bean,Abrus precatorius,"Rosary Pea, Buddhist rosary bead, Indian Bead, Indian Licorice, Love Bean, Lucky Bean, Seminole Bead, Weather Plant, Prayer Bean",Leguminosae,https://www.aspca.org/sites/default/files/styles/medium_image_300x200/public/field/image/plants/precatory-bean-r.jpg?itok=0TUt1pvz,https://www.aspca.org//pet-care/animal-poison-control/toxic-and-non-toxic-plants/precatory-bean,FALSE,FALSE,FALSE,"Severe vomiting and diarrhea (sometimes bloody), tremors, high heart rate, fever, shock, death. Seeds are very toxic (seed coat must be broken)."
Prickly Bottlebrush,Callistemon species,"Bottlebrush, Weeping Bottlebrush, Crimson Bottlebrush",Myrtaceae,https://www.aspca.org/sites/default/files/styles/medium_image_300x200/public/field/image/plants/weeping-bottlebrush-r.jpg?itok=nLg91Ylc,https://www.aspca.org//pet-care/animal-poison-control/toxic-and-non-toxic-plants/prickly-bottlebrush,TRUE,TRUE,TRUE,"Do not confuse with Aesculus parviflora, a toxic Buckeye ""Bottlebrush"" plant containing Aesculin."
Pride-of-India,Melia azedarach,"China Ball Tree, Paradise Tree, Persian Lilac, White Cedar, Japanese Bead Tree, Texas Umbrella Tree, Bead Tree, Chinaberry Tree",Meliaceae,https://www.aspca.org/sites/default/files/styles/medium_image_300x200/public/field/image/plants/bead-tree-r.jpg?itok=dQ4xzmpz,https://www.aspca.org//pet-care/animal-poison-control/toxic-and-non-toxic-plants/pride-india,FALSE,FALSE,FALSE,"Diarrhea, vomiting, salivation, depression, weakness, and seizures. Ripe fruit (berries) most toxic but also bark, leaves, and flowers."
Primrose,Primula vulgaris,null,Primulaceae,https://www.aspca.org/sites/default/files/styles/medium_image_300x200/public/field/image/plants/primrose-r.jpg?itok=0yzdx0GU,https://www.aspca.org//pet-care/animal-poison-control/toxic-and-non-toxic-plants/primrose,FALSE,FALSE,FALSE,Mild vomiting
Privet,Ligustrum japonicum,"amur, wax-leaf, common privet",Oleaceae,https://www.aspca.org/sites/default/files/styles/medium_image_300x200/public/field/image/plants/common-privet-r.jpg?itok=BAP-H7J6,https://www.aspca.org//pet-care/animal-poison-control/toxic-and-non-toxic-plants/privet,FALSE,FALSE,FALSE,"Gastrointestinal upset (most common), incoordination, increased heart rate, death (rare)."
Prostrate Coleus,Plectranthus oetendahlii,,Lamiaceae,https://www.aspca.org/sites/default/files/styles/medium_image_300x200/public/default_images/imageunavailable_0.jpg?itok=JCCt_uvE,https://www.aspca.org//pet-care/animal-poison-control/toxic-and-non-toxic-plants/prostrate-coleus,TRUE,TRUE,FALSE,Non-toxic
Pupleosier Willow,Salix purpurea,,Saliaceae,https://www.aspca.org/sites/default/files/styles/medium_image_300x200/public/default_images/imageunavailable_0.jpg?itok=JCCt_uvE,https://www.aspca.org//pet-care/animal-poison-control/toxic-and-non-toxic-plants/pupleosier-willow,TRUE,TRUE,TRUE,null
Purple Baby Tears,Frithia pulchra,fairy elephant's feet,Aizoaceae,https://www.aspca.org/sites/default/files/styles/medium_image_300x200/public/default_images/imageunavailable_0.jpg?itok=JCCt_uvE,https://www.aspca.org//pet-care/animal-poison-control/toxic-and-non-toxic-plants/purple-baby-tears,TRUE,TRUE,FALSE,null
Purple Passion Vine,Gynura aurantica,"Velvet Plant, Royal Velvet Plant, Purple Velvet Plant",Asteraceae,https://www.aspca.org/sites/default/files/styles/medium_image_300x200/public/default_images/imageunavailable_0.jpg?itok=JCCt_uvE,https://www.aspca.org//pet-care/animal-poison-control/toxic-and-non-toxic-plants/purple-passion-vine,TRUE,TRUE,FALSE,Non-toxic
Purple Velvet Plant,Gynura aurantica,"Velvet Plant, Royal Velvet Plant, Purple Passion Vine",Asteraceae,https://www.aspca.org/sites/default/files/styles/medium_image_300x200/public/default_images/imageunavailable_0.jpg?itok=JCCt_uvE,https://www.aspca.org//pet-care/animal-poison-control/toxic-and-non-toxic-plants/purple-velvet-plant,TRUE,TRUE,FALSE,Non-toxic
Purple Waffle Plant,Hemigraphis exotica,waffle plant,Acanthaceae,https://www.aspca.org/sites/default/files/styles/medium_image_300x200/public/default_images/imageunavailable_0.jpg?itok=JCCt_uvE,https://www.aspca.org//pet-care/animal-poison-control/toxic-and-non-toxic-plants/purple-waffle-plant,TRUE,TRUE,FALSE,null
Purslane,Portulaca oleracea,"Wild Portulaca, Rock Moss, Portulaca, Pigwee, Pusley, Moss Rose",Portulacaceae,https://www.aspca.org/sites/default/files/styles/medium_image_300x200/public/default_images/imageunavailable_0.jpg?itok=JCCt_uvE,https://www.aspca.org//pet-care/animal-poison-control/toxic-and-non-toxic-plants/purslane,FALSE,FALSE,FALSE,null
Queencup,Clintonia uniflora,Bride's Bonnet,Liliaceae,https://www.aspca.org/sites/default/files/styles/medium_image_300x200/public/field/image/plants/queencup-r.jpg?itok=J8GFye8C,https://www.aspca.org//pet-care/animal-poison-control/toxic-and-non-toxic-plants/queencup,TRUE,TRUE,FALSE,null
Queens Spiderwort,Dichorisandra reginae,,Commelinaceae,https://www.aspca.org/sites/default/files/styles/medium_image_300x200/public/default_images/imageunavailable_0.jpg?itok=JCCt_uvE,https://www.aspca.org//pet-care/animal-poison-control/toxic-and-non-toxic-plants/queens-spiderwort,TRUE,TRUE,FALSE,null
Queensland Arrowroot,Canna edulis,"Achira, Canna, Arrowroot",Cannaceae,https://www.aspca.org/sites/default/files/styles/medium_image_300x200/public/field/image/plants/achira-r.jpg?itok=iQMC4kSf,https://www.aspca.org//pet-care/animal-poison-control/toxic-and-non-toxic-plants/queensland-arrowroot,TRUE,TRUE,TRUE,null
Queensland Nut,Macadamia integrifolia,"Macadamia Nut, Australia Nut",Proteaceae,https://www.aspca.org/sites/default/files/styles/medium_image_300x200/public/field/image/plants/macadamia-nut-r.jpg?itok=NzjVmw5J,https://www.aspca.org//pet-care/animal-poison-control/toxic-and-non-toxic-plants/queensland-nut,FALSE,FALSE,FALSE,"Dogs: depression, weakness (especially of rear limbs), vomiting, tremors."
Rabbits Foot Fern,Davallia spp.,"Hare Fern, Squirrel Foot Fern, Deer Foot Fern, Ball Fern",Polypodiaceae,https://www.aspca.org/sites/default/files/styles/medium_image_300x200/public/default_images/imageunavailable_0.jpg?itok=JCCt_uvE,https://www.aspca.org//pet-care/animal-poison-control/toxic-and-non-toxic-plants/rabbits-foot-fern,TRUE,TRUE,FALSE,null
Racemose asparagus,Asparagus densiflorus cv sprengeri,"Asparagus, Emerald Feather, Emerald Fern, Sprengeri Fern, Plumosa Fern, Lace Fern, Asparagus Fern, Shatavari",Liliaceae,https://www.aspca.org/sites/default/files/styles/medium_image_300x200/public/field/image/plants/asparagus-fern-r.jpg?itok=t-jWcv3E,https://www.aspca.org//pet-care/animal-poison-control/toxic-and-non-toxic-plants/racemose-asparagus,FALSE,FALSE,FALSE,"allergic dermatitis with repeated dermal exposure. Berry ingestion could result in gastric upset (vomiting, abdominal pain, or diarrhea.)"
Ragwort,Senecio species,"Golden Ragwort, Tansy",Compositae,https://www.aspca.org/sites/default/files/styles/medium_image_300x200/public/field/image/plants/ragwort-r.jpg?itok=k8xM44JR,https://www.aspca.org//pet-care/animal-poison-control/toxic-and-non-toxic-plants/ragwort,FALSE,FALSE,FALSE,"The plant is not very palatable, but will be eaten by animals with no other forage; poisonings typically occur from ingestion of green plant material or material in hay. The toxic components can cause liver failure, referred to as ""walking disease"" or ""sleepy staggers"". Signs include weight loss, weakness, sleepiness, yawning, incoordination, yellowish discoloration to mucous membranes (icterus), neurologic problems secondary to liver failure (aimless walking, chewing motions, head pressing). Animals may appear to be normal at first, then become suddenly affected; the syndrome progresses rapidly over a few days to a week. Liver damage, depression, anorexia, vomiting, diarrhea, muddy mucous membranes, weakness, ataxia."
Rainbow Orchid,Epidendrum prismatocarpum,null,Orchidaceae,https://www.aspca.org/sites/default/files/styles/medium_image_300x200/public/field/image/plants/rainbow-orchid-r.jpg?itok=3FAQFNh3,https://www.aspca.org//pet-care/animal-poison-control/toxic-and-non-toxic-plants/rainbow-orchid,TRUE,TRUE,FALSE,null
Ranger's Button,Sphenosciadium capitellatum,White Heads,Apiaceae,https://www.aspca.org/sites/default/files/styles/medium_image_300x200/public/field/image/plants/rangers-button-r.jpg?itok=FA3uxT4U,https://www.aspca.org//pet-care/animal-poison-control/toxic-and-non-toxic-plants/rangers-button,FALSE,FALSE,FALSE,"Photosensitization (ulcerative and exudative dermatitis), ocular toxicity."
Rattlebox,Crotalaria albida,null,Papilionaceae,https://www.aspca.org/sites/default/files/styles/medium_image_300x200/public/field/image/plants/rattlebox-r.jpg?itok=ujDQjuHa,https://www.aspca.org//pet-care/animal-poison-control/toxic-and-non-toxic-plants/rattlebox,FALSE,FALSE,FALSE,"The plant is not very palatable, but will be eaten by animals with no other forage; poisonings typically occur from ingestion of green plant material or material in hay. The toxic components can cause liver failure, referred to as ""walking disease"" or ""sleepy staggers"". Signs include weight loss, weakness, sleepiness, yawning, incoordination, yellowish discoloration to mucous membranes (icterus), neurologic problems secondary to liver failure (aimless walking, chewing motions, head pressing). Animals may appear to be normal at first, then become suddenly affected; the syndrome progresses rapidly over a few days to a week."
Rayless Goldenrod,Haplopappus heterophyllus,null,Asteraceae,https://www.aspca.org/sites/default/files/styles/medium_image_300x200/public/field/image/plants/rayless-goldenrod-r.jpg?itok=WjXUKM9T,https://www.aspca.org//pet-care/animal-poison-control/toxic-and-non-toxic-plants/rayless-goldenrod,FALSE,FALSE,FALSE,"Plant is toxic year round, although poisonings typically occur in summer and late fall. Horses eating one to ten percent of their body weight in the plant can develop lethal clinical effects. Onset of signs generally occurs after two days to three weeks, and includes incoordination, muscle weakness and tremors, elevated heart rate, cardiac arrhythmias, fluid accumulation and swelling of the nervous system, profuse sweating, inability to swallow."
Red African Violet,Episcia reptans,Flame African Violet,Gesneriaceae,https://www.aspca.org/sites/default/files/styles/medium_image_300x200/public/default_images/imageunavailable_0.jpg?itok=JCCt_uvE,https://www.aspca.org//pet-care/animal-poison-control/toxic-and-non-toxic-plants/red-african-violet,TRUE,TRUE,FALSE,null
Red Berried Greenbrier,Smilax walteria,red-berried-bamboo,Liliaceae,https://www.aspca.org/sites/default/files/styles/medium_image_300x200/public/default_images/imageunavailable_0.jpg?itok=JCCt_uvE,https://www.aspca.org//pet-care/animal-poison-control/toxic-and-non-toxic-plants/red-berried-greenbrier,TRUE,TRUE,TRUE,"Vomiting, diarrhea and depression. Leaves and berries are low toxicity."
Red Edge Peperomia,Peperomia clusiifolia,,Piperaceae,https://www.aspca.org/sites/default/files/styles/medium_image_300x200/public/default_images/imageunavailable_0.jpg?itok=JCCt_uvE,https://www.aspca.org//pet-care/animal-poison-control/toxic-and-non-toxic-plants/red-edge-peperomia,TRUE,TRUE,FALSE,null
Red Emerald,Philodendron bipennifolium,"Horsehead Philodendron, Cordatum, Heartleaf Philodendron, Panda Plant, Split Leaf Philodendron, Fruit Salad Plant, Fiddle Leaf, Red Princess, Saddle Leaf",Araceae,https://www.aspca.org/sites/default/files/styles/medium_image_300x200/public/default_images/imageunavailable_0.jpg?itok=JCCt_uvE,https://www.aspca.org//pet-care/animal-poison-control/toxic-and-non-toxic-plants/red-emerald,FALSE,FALSE,FALSE,"Oral irritation, intense burning and irritation of mouth, tongue and lips, excessive drooling, vomiting, difficulty swallowing."
Red Hawthorne,Crataegus species,"Haws, Pirliteiro",Rosaceae,https://www.aspca.org/sites/default/files/styles/medium_image_300x200/public/default_images/imageunavailable_0.jpg?itok=JCCt_uvE,https://www.aspca.org//pet-care/animal-poison-control/toxic-and-non-toxic-plants/red-hawthorne,TRUE,TRUE,TRUE,null
Red Lily,Lilium umbellatum,null,Liliaceae,https://www.aspca.org/sites/default/files/styles/medium_image_300x200/public/field/image/plants/red-lily-r.jpg?itok=Yj85Pnl_,https://www.aspca.org//pet-care/animal-poison-control/toxic-and-non-toxic-plants/red-lily,FALSE,TRUE,TRUE,"Vomiting, inappetence, lethargy, kidney failure, and death is possible. Cats are only species known to be affected."
Red Maple,Acer rubrum,"Swamp Maple, Scarlet Maple, Curled Maple, Soft Maple",Aceraceae,https://www.aspca.org/sites/default/files/styles/medium_image_300x200/public/field/image/plants/red-maple-swamp-maple-r.jpg?itok=0gmrSo75,https://www.aspca.org//pet-care/animal-poison-control/toxic-and-non-toxic-plants/red-maple,FALSE,FALSE,FALSE,"Wilted leaves are considered to be most toxic. Damage to red blood cells, resulting in decreased ability to carry oxygen to tissues; darkening of the membranes around the eyes/mouth,weakness, feed refusal, central nervous system depression, abdominal discomfort, laminitis, discolored urine, abortion in pregnant mares. Death can occur within 18 hours or as long as 7-10 days after ingestion. Most cases of poisoning are reported during midsummer through early winter."
Red Palm Lily,Cordyline rubra,red frutied palm lily,Agavaceae,https://www.aspca.org/sites/default/files/styles/medium_image_300x200/public/default_images/imageunavailable_0.jpg?itok=JCCt_uvE,https://www.aspca.org//pet-care/animal-poison-control/toxic-and-non-toxic-plants/red-palm-lily,TRUE,TRUE,FALSE,null
Red Princess,Philodendron bipennifolium,"Horsehead Philodendron, Cordatum, Heartleaf Philodendron, Panda Plant, Split Leaf Philodendron, Fruit Salad Plant, Fiddle Leaf, Red Emerald, Saddle Leaf",Araceae,https://www.aspca.org/sites/default/files/styles/medium_image_300x200/public/default_images/imageunavailable_0.jpg?itok=JCCt_uvE,https://www.aspca.org//pet-care/animal-poison-control/toxic-and-non-toxic-plants/red-princess,FALSE,FALSE,FALSE,"Oral irritation, intense burning and irritation of mouth, tongue and lips, excessive drooling, vomiting, difficulty swallowing."
Red Veined Prayer,Calathea insignis,"Maranta, Prayer Plant",Marantaceae,https://www.aspca.org/sites/default/files/styles/medium_image_300x200/public/default_images/imageunavailable_0.jpg?itok=JCCt_uvE,https://www.aspca.org//pet-care/animal-poison-control/toxic-and-non-toxic-plants/red-veined-prayer,TRUE,TRUE,FALSE,null
Red-Marginated Dracaena,Dracaena marginata,straight-marginated dracaena,Agavaceae,https://www.aspca.org/sites/default/files/styles/medium_image_300x200/public/field/image/plants/red-margined-dracaena-r.jpg?itok=FOLQQnFx,https://www.aspca.org//pet-care/animal-poison-control/toxic-and-non-toxic-plants/red-marginated-dracaena,FALSE,FALSE,FALSE,"In cats: dilated pupils, abdominal pain, increased heartrate and drooling. In both cats and dogs: vomiting, depression, inappetence, drooling, incoordination, and weakness."
Reed Palm,Chamaedorea elegans,"Bamboo palm, Miniature Fish Tail Dwarf Palm, Parlor Palm, Good Luck Palm",Palmae,https://www.aspca.org/sites/default/files/styles/medium_image_300x200/public/field/image/plants/good-luck-palm-r.jpg?itok=ntv9y8-g,https://www.aspca.org//pet-care/animal-poison-control/toxic-and-non-toxic-plants/reed-palm,TRUE,TRUE,FALSE,null
Resurrection Lily,Kaempferia,"Peacock Ginger, Kaempferia",Zingiberaceae,https://www.aspca.org/sites/default/files/styles/medium_image_300x200/public/default_images/imageunavailable_0.jpg?itok=JCCt_uvE,https://www.aspca.org//pet-care/animal-poison-control/toxic-and-non-toxic-plants/resurrection-lily,TRUE,TRUE,TRUE,null
Rex Begonia,Begonia rex,,Begoniaceae,https://www.aspca.org/sites/default/files/styles/medium_image_300x200/public/default_images/imageunavailable_0.jpg?itok=JCCt_uvE,https://www.aspca.org//pet-care/animal-poison-control/toxic-and-non-toxic-plants/rex-begonia,TRUE,TRUE,FALSE,null
Rhododendron,Rhododendron spp,"Rosebay, Azalea",Ericaceae,https://www.aspca.org/sites/default/files/styles/medium_image_300x200/public/field/image/plants/rhododendron-rosebay-2-r.jpg?itok=5-7GKqkw,https://www.aspca.org//pet-care/animal-poison-control/toxic-and-non-toxic-plants/rhododendron,FALSE,FALSE,FALSE,"Vomiting, diarrhea, hypersalivation, weakness, coma, hypotension, CNS depression, cardiovascular collapse and death. Ingestion of a few leaves can cause serious problems. Rhododendron is typically not very palatable to horses unless it is the only forage available, but sheep and goats may graze readily on the plant. The toxic principle interferes with normal skeletal muscle, cardiac muscle and nerve function. Clinical effects typically occur within a few hours after ingestion, and can include acute digestive upset, excessive drooling, loss of appetite, frequent bowel movements/diarrhea, colic, depression, weakness, loss of coordination, stupor, leg paralysis, weak heart rate and recumbency for 2 or more days; at this point, improvement may be seen or the animal may become comatose and die."
Rhubarb,Rheum rhabarbarium,Pie Plant,Polygonaceae,https://www.aspca.org/sites/default/files/styles/medium_image_300x200/public/field/image/plants/rhubarb-r.jpg?itok=hVIwd-mu,https://www.aspca.org//pet-care/animal-poison-control/toxic-and-non-toxic-plants/rhubarb,FALSE,FALSE,FALSE,"Kidney failure, tremors, salivation."
Rhynchophorum,Peperomia obtusifolia,"Pepper Face, Baby Rubber Plant, American Rubber Plant",Pipericeae,https://www.aspca.org/sites/default/files/styles/medium_image_300x200/public/default_images/imageunavailable_0.jpg?itok=JCCt_uvE,https://www.aspca.org//pet-care/animal-poison-control/toxic-and-non-toxic-plants/rhynchophorum,TRUE,TRUE,FALSE,null
Ribbon Plant,Dracaena spp.,"Corn Plant, Cornstalk Plant, Dracaena, Dragon Tree",Agavaceae,https://www.aspca.org/sites/default/files/styles/medium_image_300x200/public/default_images/imageunavailable_0.jpg?itok=JCCt_uvE,https://www.aspca.org//pet-care/animal-poison-control/toxic-and-non-toxic-plants/ribbon-plant,FALSE,FALSE,FALSE,"Vomiting (occasionally with blood), depression, anorexia, hypersalivation, dilated pupils (cats)."
Ribbon Plant (Chlorophytum Comosum),Chlorophytum comosum,"anthericum, walking anthericum, spider ivy, spider plant",Liliaceae,https://www.aspca.org/sites/default/files/styles/medium_image_300x200/public/default_images/imageunavailable_0.jpg?itok=JCCt_uvE,https://www.aspca.org//pet-care/animal-poison-control/toxic-and-non-toxic-plants/ribbon-plant-chlorophytum-comosum,TRUE,TRUE,FALSE,null
Ridderstjerne,Hippeastrum spp.,"Amaryllis, Fire Lily, Lily of the Palace, Barbados Lily",Amaryllidaceae,https://www.aspca.org/sites/default/files/styles/medium_image_300x200/public/default_images/imageunavailable_0.jpg?itok=JCCt_uvE,https://www.aspca.org//pet-care/animal-poison-control/toxic-and-non-toxic-plants/ridderstjerne,FALSE,FALSE,FALSE,"Vomiting, salvation, diarrhea; large ingestions cause convulsions, low blood pressure, tremors and cardiac arrhythmias. Bulbs are the most poisonous part."
Rock Moss,Portulaca oleracea,"Wild Portulaca, Moss Rose, Purslane, Pigwee, Pusley",Portulacaceae,https://www.aspca.org/sites/default/files/styles/medium_image_300x200/public/default_images/imageunavailable_0.jpg?itok=JCCt_uvE,https://www.aspca.org//pet-care/animal-poison-control/toxic-and-non-toxic-plants/rock-moss,FALSE,FALSE,FALSE,null
Roman Chamomile,Anthemis nobilis,"Chamomile, Garden Chamomile, Ground Apple",Asteraceae,https://www.aspca.org/sites/default/files/styles/medium_image_300x200/public/default_images/imageunavailable_0.jpg?itok=JCCt_uvE,https://www.aspca.org//pet-care/animal-poison-control/toxic-and-non-toxic-plants/roman-chamomile,FALSE,FALSE,FALSE,"Contact dermatitis, vomiting, diarrhea, anorexia, allergic reactions. Long term use can lead to bleeding tendencies."
Roosevelt Fern,Nephrolepis biserrata,Bold Sword Fern,Dryopteridaceae,https://www.aspca.org/sites/default/files/styles/medium_image_300x200/public/default_images/imageunavailable_0.jpg?itok=JCCt_uvE,https://www.aspca.org//pet-care/animal-poison-control/toxic-and-non-toxic-plants/roosevelt-fern,TRUE,TRUE,TRUE,null
Rose,Rosa Species,,Rosaceae,https://www.aspca.org/sites/default/files/styles/medium_image_300x200/public/default_images/imageunavailable_0.jpg?itok=JCCt_uvE,https://www.aspca.org//pet-care/animal-poison-control/toxic-and-non-toxic-plants/rose,TRUE,TRUE,TRUE,null
Rose of China,Hibiscus syriacus,"Hibiscus, Rose of Sharon",Malvaceae,https://www.aspca.org/sites/default/files/styles/medium_image_300x200/public/field/image/plants/hibiscus-r.jpg?itok=e3MHHXcx,https://www.aspca.org//pet-care/animal-poison-control/toxic-and-non-toxic-plants/rose-china,FALSE,FALSE,FALSE,"Vomiting, diarrhea, nausea, anorexia."
Rose of Sharon,Hibiscus syriacus,"Hibiscus, Rose of China",Malvaceae,https://www.aspca.org/sites/default/files/styles/medium_image_300x200/public/field/image/plants/hibiscus-r.jpg?itok=e3MHHXcx,https://www.aspca.org//pet-care/animal-poison-control/toxic-and-non-toxic-plants/rose-sharon,FALSE,FALSE,FALSE,"Vomiting, diarrhea, nausea, anorexia."
