name,sci_name,common_names,family,image_url,aspca_url,non_toxicity_cats,non_toxicity_dogs,non_toxicity_horses,clinical_signs
Laurel-Leaved Greenbrier,Smilax laurifolia,"Blaspheme vine, Bamboo Vine",Liliaceae,https://www.aspca.org/sites/default/files/styles/medium_image_300x200/public/field/image/plants/blaspheme-vine-r.jpg?itok=iutJYeCr,https://www.aspca.org//pet-care/animal-poison-control/toxic-and-non-toxic-plants/laurel-leaved-greenbrier,TRUE,TRUE,TRUE,null
Leather Peperomia,Peperomia crassifolia,,,https://www.aspca.org/sites/default/files/styles/medium_image_300x200/public/default_images/imageunavailable_0.jpg?itok=JCCt_uvE,https://www.aspca.org//pet-care/animal-poison-control/toxic-and-non-toxic-plants/leather-peperomia,TRUE,TRUE,FALSE,null
Leatherflower,Clematis sp.,"Clematis, Virgin's Bower",Ranunculaceae,https://www.aspca.org/sites/default/files/styles/medium_image_300x200/public/field/image/plants/clematis-r.jpg?itok=sVht9aKb,https://www.aspca.org//pet-care/animal-poison-control/toxic-and-non-toxic-plants/leatherflower,FALSE,FALSE,FALSE,"Salivation, vomiting, diarrhea."
Leek,Allium ampeloprasum,Elephant Garlic,Liliaceae,https://www.aspca.org/sites/default/files/styles/medium_image_300x200/public/default_images/imageunavailable_0.jpg?itok=JCCt_uvE,https://www.aspca.org//pet-care/animal-poison-control/toxic-and-non-toxic-plants/leek,FALSE,FALSE,FALSE,"Vomiting, breakdown of red blood cells (hemolytic anemia, Heinz body anemia), blood in urine, weakness, high heart rate, panting"
Lemon,Citrus limonia,null,Rutaceae,https://www.aspca.org/sites/default/files/styles/medium_image_300x200/public/field/image/plants/lemon-r.jpg?itok=31F8z1RM,https://www.aspca.org//pet-care/animal-poison-control/toxic-and-non-toxic-plants/lemon,FALSE,FALSE,FALSE,"Vomiting, diarrhea, depression; potential photosensitivity"
Lenten Rose,Helleborus niger,"Hellebore, Christmas Rose, Easter Rose",Ranunculaceae,https://www.aspca.org/sites/default/files/styles/medium_image_300x200/public/field/image/plants/christmas-rose-r.jpg?itok=cqfmgqS-,https://www.aspca.org//pet-care/animal-poison-control/toxic-and-non-toxic-plants/lenten-rose,FALSE,FALSE,FALSE,"Drooling, abdominal pain and diarrhea, colic, depression."
Leopard Lily,Lachenalia lilacina,,Hyacinthaceae,https://www.aspca.org/sites/default/files/styles/medium_image_300x200/public/default_images/imageunavailable_0.jpg?itok=JCCt_uvE,https://www.aspca.org//pet-care/animal-poison-control/toxic-and-non-toxic-plants/leopard-lily,TRUE,TRUE,FALSE,null
Leopard Orchid,Dendrobium gracilicaule,Tiger Orchid,Orchidaceae,https://www.aspca.org/sites/default/files/styles/medium_image_300x200/public/default_images/imageunavailable_0.jpg?itok=JCCt_uvE,https://www.aspca.org//pet-care/animal-poison-control/toxic-and-non-toxic-plants/leopard-orchid,TRUE,TRUE,FALSE,null
Lesser Snapdragon,Antirrhinum orontium,,Mimosaceae,https://www.aspca.org/sites/default/files/styles/medium_image_300x200/public/default_images/imageunavailable_0.jpg?itok=JCCt_uvE,https://www.aspca.org//pet-care/animal-poison-control/toxic-and-non-toxic-plants/lesser-snapdragon,TRUE,TRUE,TRUE,null
Lily,Lilium species,null,Liliaceae,https://www.aspca.org/sites/default/files/styles/medium_image_300x200/public/field/image/plants/lily-r.jpg?itok=Eqrw0vzV,https://www.aspca.org//pet-care/animal-poison-control/toxic-and-non-toxic-plants/lily,FALSE,TRUE,TRUE,Cats: kidney failure.
Lily of the Palace,Hippeastrum spp.,"Amaryllis, Fire Lily, Barbados Lily, Ridderstjerne",Amaryllidaceae,https://www.aspca.org/sites/default/files/styles/medium_image_300x200/public/field/image/plants/barbados-lily-r.jpg?itok=SVpwywsB,https://www.aspca.org//pet-care/animal-poison-control/toxic-and-non-toxic-plants/lily-palace,FALSE,FALSE,FALSE,"Vomiting, salvation, diarrhea; large ingestions cause convulsions, low blood pressure, tremors and cardiac arrhythmias. Bulbs are the most poisonous part."
Lily of the Valley,Convallaria majalis,null,Liliaceae,https://www.aspca.org/sites/default/files/styles/medium_image_300x200/public/field/image/plants/lily-of-the-valley-r.jpg?itok=2-V59cXR,https://www.aspca.org//pet-care/animal-poison-control/toxic-and-non-toxic-plants/lily-valley,FALSE,FALSE,FALSE,"Vomiting, irregular heart beat, low blood pressure, disorientation, coma, seizures"
Lily of the Valley Orchid,Odontoglossum pulchellum,,Orchidaceae,https://www.aspca.org/sites/default/files/styles/medium_image_300x200/public/default_images/imageunavailable_0.jpg?itok=JCCt_uvE,https://www.aspca.org//pet-care/animal-poison-control/toxic-and-non-toxic-plants/lily-valley-orchid,TRUE,TRUE,FALSE,null
Lily-of-the-Valley Bush,Pieris japonica,"Andromeda Japonica, Pieris",Ericaceae,https://www.aspca.org/sites/default/files/styles/medium_image_300x200/public/field/image/plants/pieris-1-r.jpg?itok=X6pqkm6x,https://www.aspca.org//pet-care/animal-poison-control/toxic-and-non-toxic-plants/lily-valley-bush,FALSE,FALSE,FALSE,"Vomiting, diarrhea, depression, cardiovascular collapse, hypersalivation, weakness, coma, low blood pressure, death. Ingestion of a few leaves can cause serious problems."
Lime,Citrus aurantifolia,null,Rutaceae,https://www.aspca.org/sites/default/files/styles/medium_image_300x200/public/field/image/plants/lime-r.jpg?itok=cn9b8ql-,https://www.aspca.org//pet-care/animal-poison-control/toxic-and-non-toxic-plants/lime,FALSE,FALSE,FALSE,"Vomiting, diarrhea, depression; potential photosensitivity"
Linden,Tilia americana,,Tiliaceae,https://www.aspca.org/sites/default/files/styles/medium_image_300x200/public/default_images/imageunavailable_0.jpg?itok=JCCt_uvE,https://www.aspca.org//pet-care/animal-poison-control/toxic-and-non-toxic-plants/linden,TRUE,TRUE,FALSE,null
Lipstick Plant,Aeschynanthus humilis,,Gesneraceae,https://www.aspca.org/sites/default/files/styles/medium_image_300x200/public/default_images/imageunavailable_0.jpg?itok=JCCt_uvE,https://www.aspca.org//pet-care/animal-poison-control/toxic-and-non-toxic-plants/lipstick-plant,TRUE,TRUE,FALSE,null
Little Fantasy Peperomia,Peperomia caperata,"Green Ripple Peperomia, Emerald Ripple Peperomia",Piperaceae,https://www.aspca.org/sites/default/files/styles/medium_image_300x200/public/default_images/imageunavailable_0.jpg?itok=JCCt_uvE,https://www.aspca.org//pet-care/animal-poison-control/toxic-and-non-toxic-plants/little-fantasy-peperomia,TRUE,TRUE,FALSE,null
Little Zebra Plant,Haworthia subfasciata,,Aloaceae,https://www.aspca.org/sites/default/files/styles/medium_image_300x200/public/default_images/imageunavailable_0.jpg?itok=JCCt_uvE,https://www.aspca.org//pet-care/animal-poison-control/toxic-and-non-toxic-plants/little-zebra-plant,TRUE,TRUE,FALSE,null
Living Rock Cactus,Pleiospilos bolusii,"African living rock, Mimicry plant",Aizoaceae,https://www.aspca.org/sites/default/files/styles/medium_image_300x200/public/default_images/imageunavailable_0.jpg?itok=JCCt_uvE,https://www.aspca.org//pet-care/animal-poison-control/toxic-and-non-toxic-plants/living-rock-cactus,TRUE,TRUE,FALSE,null
Living Stones,Lithops naureeniae,"Kiawe, Mesquite",Aizoaceae,https://www.aspca.org/sites/default/files/styles/medium_image_300x200/public/default_images/imageunavailable_0.jpg?itok=JCCt_uvE,https://www.aspca.org//pet-care/animal-poison-control/toxic-and-non-toxic-plants/living-stones,TRUE,TRUE,FALSE,null
Lobelia,Lobelia cardinalis,"Cardinal Flower, Indian Pink",Campanulaceae,https://www.aspca.org/sites/default/files/styles/medium_image_300x200/public/field/image/plants/lobelia-r.jpg?itok=chIrnDSs,https://www.aspca.org//pet-care/animal-poison-control/toxic-and-non-toxic-plants/lobelia,FALSE,FALSE,FALSE,"Depression, diarrhea, vomiting, excessive salivation, abdominal pain, heart rhythm disturbances."
Loco Weed,Astragalus and Oxytropis species,null,Fabaceae,https://www.aspca.org/sites/default/files/styles/medium_image_300x200/public/field/image/plants/loco-weed-r.jpg?itok=syFSBAGM,https://www.aspca.org//pet-care/animal-poison-control/toxic-and-non-toxic-plants/loco-weed,FALSE,FALSE,FALSE,"The plant is not very palatable, but will be eaten by animals with no other forage; once eaten, animals become ""addicted"" to the plant and will not consume other forage. The toxic principle has the most profound effect on the brain, and toxicity (known as ""locoism"") occurs after ingestion of more than 30% of the animal's body weight over a period of 6 weeks or longer. Clinical signs include a loss of sensory and motor nerve function, central nervous system depression, progressive loss of coordination, inability to eat and drink, as well as fetal death and birth defects. Affected animals may become excessively excitable and wild when stimulated, and may also become unaware of their surroundings."
Locust,Robinia species,null,Mimosaceae,https://www.aspca.org/sites/default/files/styles/medium_image_300x200/public/field/image/plants/locust-r.jpg?itok=1phSZ5YV,https://www.aspca.org//pet-care/animal-poison-control/toxic-and-non-toxic-plants/locust,FALSE,FALSE,FALSE,"Toxicity occurs from grazing young sprouts, ingesting bark or pruned/fallen branches. Clinical signs may develop one to two hours post ingestion, and may include loss of appetite, depression, stupor, weakness with rear end paralysis, laminitis, coldness of the extremities, dilated pupils, difficulty breathing, weak, irregular pulse, diarrhea (which may be bloody). Primary damage is to the gastrointestinal tract; long term effects can include chronic laminitis."
Locust Pods,Ceratonia siliqua,"Carob Tree, Sugar Pods, Kharoub, Beans",,https://www.aspca.org/sites/default/files/styles/medium_image_300x200/public/default_images/imageunavailable_0.jpg?itok=JCCt_uvE,https://www.aspca.org//pet-care/animal-poison-control/toxic-and-non-toxic-plants/locust-pods,TRUE,TRUE,TRUE,null
Lord-and-Ladies,Arum maculatum,"Arum, Wake Robin, Adam-and-Eve, Starch Root, Bobbins, Cuckoo Plant",Araceae,https://www.aspca.org/sites/default/files/styles/medium_image_300x200/public/field/image/plants/arum-r.jpg?itok=I6KyQVcY,https://www.aspca.org//pet-care/animal-poison-control/toxic-and-non-toxic-plants/lord-and-ladies,FALSE,FALSE,FALSE,"Oral irritation, intense burning and irritation of mouth, tongue and lips, excessive drooling, vomiting, difficulty swallowing"
Macadamia Nut,Macadamia integrifolia,"Australia Nut, Queensland Nut",Proteaceae,https://www.aspca.org/sites/default/files/styles/medium_image_300x200/public/field/image/plants/macadamia-nut-r.jpg?itok=NzjVmw5J,https://www.aspca.org//pet-care/animal-poison-control/toxic-and-non-toxic-plants/macadamia-nut,FALSE,FALSE,FALSE,"Dogs: depression, weakness (especially of rear limbs), vomiting, tremors."
Madagascar Dragon Tree,Dracaena marginata,null,Agavaceae,https://www.aspca.org/sites/default/files/styles/medium_image_300x200/public/field/image/plants/madagascar-dragon-tree-r.jpg?itok=Nsw049Bd,https://www.aspca.org//pet-care/animal-poison-control/toxic-and-non-toxic-plants/madagascar-dragon-tree,FALSE,FALSE,FALSE,"Vomiting (occasionally with blood), depression, anorexia, hypersalivation, dilated pupils (cats)."
Madagascar Jasmine,Stephanotis floribunda,"Wax Flower, Bride's Flower, Clustered Wax Flower",Ascleopiadaceae,https://www.aspca.org/sites/default/files/styles/medium_image_300x200/public/default_images/imageunavailable_0.jpg?itok=JCCt_uvE,https://www.aspca.org//pet-care/animal-poison-control/toxic-and-non-toxic-plants/madagascar-jasmine,TRUE,TRUE,TRUE,null
Magnolia Bush,Magnolia stellata,Star Magnolia,Magnoliaceae,https://www.aspca.org/sites/default/files/styles/medium_image_300x200/public/default_images/imageunavailable_0.jpg?itok=JCCt_uvE,https://www.aspca.org//pet-care/animal-poison-control/toxic-and-non-toxic-plants/magnolia-bush,TRUE,TRUE,TRUE,null
Mahonia,Mahonia aquifolium,"Oregon Grape, Oregon Grape Holly, Mahonia aguifolium, Holly-leaved berry",Berberidaceae,https://www.aspca.org/sites/default/files/styles/medium_image_300x200/public/default_images/imageunavailable_0.jpg?itok=JCCt_uvE,https://www.aspca.org//pet-care/animal-poison-control/toxic-and-non-toxic-plants/mahonia,TRUE,TRUE,TRUE,null
Maidens Breath,Gypsophila elegans,Baby's Breath,Caryophyllaceae,https://www.aspca.org/sites/default/files/styles/medium_image_300x200/public/field/image/plants/babys-breath-r_0.jpg?itok=Zpu1eqbR,https://www.aspca.org//pet-care/animal-poison-control/toxic-and-non-toxic-plants/maidens-breath,FALSE,FALSE,FALSE,"Vomiting, diarrhea."
Majesty Palm ,Ravenea rivularis,Majestic Palm,Aracaceae,https://www.aspca.org/sites/default/files/styles/medium_image_300x200/public/default_images/imageunavailable_0.jpg?itok=JCCt_uvE,https://www.aspca.org//pet-care/animal-poison-control/toxic-and-non-toxic-plants/majesty-palm,TRUE,TRUE,TRUE,null
Malabar Gourd,Cucurbita ficifolia,Fig-leaf gourd,Cucurbitaceae,https://www.aspca.org/sites/default/files/styles/medium_image_300x200/public/field/image/plants/fig-leaf-gourd-r_0.jpg?itok=c-iXiqnG,https://www.aspca.org//pet-care/animal-poison-control/toxic-and-non-toxic-plants/malabar-gourd,TRUE,TRUE,TRUE,null
Malanga,Colocasia esculenta,"Caladium, Elephant's Ears",Araceae,https://www.aspca.org/sites/default/files/styles/medium_image_300x200/public/field/image/plants/malanga-r.jpg?itok=uF2N-jdd,https://www.aspca.org//pet-care/animal-poison-control/toxic-and-non-toxic-plants/malanga,FALSE,FALSE,FALSE,"Oral irritation, intense burning and irritation of mouth, tongue and lips, excessive drooling, vomiting, difficulty swallowing."
Malaysian Dracaema,Pleomele reflexa,Song of India,Rusaceae,https://www.aspca.org/sites/default/files/styles/medium_image_300x200/public/default_images/imageunavailable_0.jpg?itok=JCCt_uvE,https://www.aspca.org//pet-care/animal-poison-control/toxic-and-non-toxic-plants/malaysian-dracaema,TRUE,TRUE,FALSE,null
Maleberry,Lyonia sp.,"Staggerbush, Fetterbush",Ericaceae,https://www.aspca.org/sites/default/files/styles/medium_image_300x200/public/field/image/plants/maleberry-r.jpg?itok=FWwr5AcW,https://www.aspca.org//pet-care/animal-poison-control/toxic-and-non-toxic-plants/maleberry,FALSE,FALSE,FALSE,"Vomiting, diarrhea, depression, cardiovascular collapse, hypersalivation, weakness, coma, low blood pressure, death. Ingestion of a few leaves can cause serious problems."
Manila Palm,Veitchia merrillii,"Dwarf Royal Palm, Christmas Palm",Arecaceae,https://www.aspca.org/sites/default/files/styles/medium_image_300x200/public/field/image/plants/christmas-palm-r_0.jpg?itok=hJpxy-zu,https://www.aspca.org//pet-care/animal-poison-control/toxic-and-non-toxic-plants/manila-palm,TRUE,TRUE,FALSE,null
Mapleleaf Begonia,Begonia cleopatra,,Begoniaceae,https://www.aspca.org/sites/default/files/styles/medium_image_300x200/public/default_images/imageunavailable_0.jpg?itok=JCCt_uvE,https://www.aspca.org//pet-care/animal-poison-control/toxic-and-non-toxic-plants/mapleleaf-begonia,TRUE,TRUE,FALSE,null
Maranta,Calathea insignis,,Marantaceae,https://www.aspca.org/sites/default/files/styles/medium_image_300x200/public/default_images/imageunavailable_0.jpg?itok=JCCt_uvE,https://www.aspca.org//pet-care/animal-poison-control/toxic-and-non-toxic-plants/maranta,TRUE,TRUE,FALSE,null
Marble Queen,Scindapsus aureus,Golden Pothos,Araceae,https://www.aspca.org/sites/default/files/styles/medium_image_300x200/public/field/image/plants/marble-queen-r.jpg?itok=q1o4mHkp,https://www.aspca.org//pet-care/animal-poison-control/toxic-and-non-toxic-plants/marble-queen,FALSE,FALSE,FALSE,null
Marbled Fingernail,Neoregelia spectabilis,Fingernail Plant,Bromeliaceae,https://www.aspca.org/sites/default/files/styles/medium_image_300x200/public/field/image/plants/fingernail-plant-r_0.jpg?itok=9qWujtI1,https://www.aspca.org//pet-care/animal-poison-control/toxic-and-non-toxic-plants/marbled-fingernail,TRUE,TRUE,FALSE,null
Marijuana,Cannabis sativa,"Indian Hemp, Hashish",Cannabaceae,https://www.aspca.org/sites/default/files/styles/medium_image_300x200/public/default_images/imageunavailable_0.jpg?itok=JCCt_uvE,https://www.aspca.org//pet-care/animal-poison-control/toxic-and-non-toxic-plants/marijuana,FALSE,FALSE,FALSE,"Prolonged depression, vomiting, incoordination, sleepiness or excitation, hypersalivaton, dilated pupils, low blood pressure, low body temperature, seizure, coma, death (rare)"
Mariposa Lily,Calochortus gunnisonii,Sego Lily,Liliaceae,https://www.aspca.org/sites/default/files/styles/medium_image_300x200/public/default_images/imageunavailable_0.jpg?itok=JCCt_uvE,https://www.aspca.org//pet-care/animal-poison-control/toxic-and-non-toxic-plants/mariposa-lily,TRUE,TRUE,FALSE,null
Maroon,Echeveria multicaulis,Copper Rose,Crassulaceae,https://www.aspca.org/sites/default/files/styles/medium_image_300x200/public/default_images/imageunavailable_0.jpg?itok=JCCt_uvE,https://www.aspca.org//pet-care/animal-poison-control/toxic-and-non-toxic-plants/maroon,TRUE,TRUE,FALSE,null
Maroon Chenille Plant,Echeveria derenbergii,"Blue Echeveria, Painted Lady, Copper Rose, Wax Rosette, Plush Plant",Crassulaceae,https://www.aspca.org/sites/default/files/styles/medium_image_300x200/public/default_images/imageunavailable_0.jpg?itok=JCCt_uvE,https://www.aspca.org//pet-care/animal-poison-control/toxic-and-non-toxic-plants/maroon-chenille-plant,TRUE,TRUE,FALSE,null
Mary-Bud,Calendula officinalis,"Marigold, Garden Marigold, Gold bloom, Pot Marigold",Compositae,https://www.aspca.org/sites/default/files/styles/medium_image_300x200/public/default_images/imageunavailable_0.jpg?itok=JCCt_uvE,https://www.aspca.org//pet-care/animal-poison-control/toxic-and-non-toxic-plants/mary-bud,TRUE,TRUE,FALSE,null
Mauna Loa Peace Lily,Spathiphyllum,Peace Lily,Araceae,https://www.aspca.org/sites/default/files/styles/medium_image_300x200/public/field/image/plants/peace-lily-r_0.jpg?itok=LZAJiX3v,https://www.aspca.org//pet-care/animal-poison-control/toxic-and-non-toxic-plants/mauna-loa-peace-lily,FALSE,FALSE,FALSE,"Oral irritation, intense burning and irritation of mouth, tongue and lips, excessive drooling, vomiting, difficulty swallowing."
Mayapple,Podophyllum peltatum,"Indian Apple Root, Umbrella Leaf, Wild Lemon, Hog Apple, Duck's Foot, Raccoonberry, American Mandrake",Berberidaceae,https://www.aspca.org/sites/default/files/styles/medium_image_300x200/public/field/image/plants/umbrella-plant-r_0.jpg?itok=eWcajQeH,https://www.aspca.org//pet-care/animal-poison-control/toxic-and-non-toxic-plants/mayapple,FALSE,FALSE,FALSE,"Vomiting, diarrhea, lethargy, panting, coma (rare); dermal - redness, skin ulcers."
Mayweed,Anthemis cotula,"Poison Daisy, Stinking Chamomile",Asteraceae,https://www.aspca.org/sites/default/files/styles/medium_image_300x200/public/field/image/plants/mayweed-r.jpg?itok=G-VjMPJk,https://www.aspca.org//pet-care/animal-poison-control/toxic-and-non-toxic-plants/mayweed,FALSE,FALSE,FALSE,"Contact dermatitis, vomiting, diarrhea, anorexia, allergic reactions. Long term use can lead to bleeding tendencies."
Meadow Saffron,Colchicum autumnale,Autumn Crocus,Liliaceae,https://www.aspca.org/sites/default/files/styles/medium_image_300x200/public/field/image/plants/autumn-crocus-r_0.jpg?itok=gHzFVkoU,https://www.aspca.org//pet-care/animal-poison-control/toxic-and-non-toxic-plants/meadow-saffron,FALSE,FALSE,FALSE,"oral irritation, bloody vomiting, diarrhea, shock, multi-organ damage, bone marrow suppression."
Measles Plant,Acantha,"Polka Dot Plant, Flamingo Plant, Baby’s Tears, Freckle Face",Acanthaceae,https://www.aspca.org/sites/default/files/styles/medium_image_300x200/public/field/image/plants/babys-tears-r_0.jpg?itok=kXWLKbs7,https://www.aspca.org//pet-care/animal-poison-control/toxic-and-non-toxic-plants/measles-plant,TRUE,TRUE,TRUE,"Mild vomiting, diarrhea."
Medicine Plant,null,"Aloe, True Aloe, Barbados Aloe",Aloaceae,https://www.aspca.org/sites/default/files/styles/medium_image_300x200/public/field/image/plants/barbados-aloe-r_0.jpg?itok=-TMqQhiZ,https://www.aspca.org//pet-care/animal-poison-control/toxic-and-non-toxic-plants/medicine-plant,FALSE,FALSE,FALSE,"Vomiting, change in urine color (red)"
Metallic Leaf Begonia,Begonia metallica,,Begoniaceae,https://www.aspca.org/sites/default/files/styles/medium_image_300x200/public/default_images/imageunavailable_0.jpg?itok=JCCt_uvE,https://www.aspca.org//pet-care/animal-poison-control/toxic-and-non-toxic-plants/metallic-leaf-begonia,TRUE,TRUE,FALSE,null
Metallic Peperomia,Peperomia caperata,,Piperaceae,https://www.aspca.org/sites/default/files/styles/medium_image_300x200/public/default_images/imageunavailable_0.jpg?itok=JCCt_uvE,https://www.aspca.org//pet-care/animal-poison-control/toxic-and-non-toxic-plants/metallic-peperomia,TRUE,TRUE,FALSE,null
Mexican Breadfruit,Monstera deliciosa,"Cutleaf Philodendron, Hurricane Plant, Swiss Cheese Plant, Ceriman, Split-leaf Philodendron, Window Leaf Plant",Araceae,https://www.aspca.org/sites/default/files/styles/medium_image_300x200/public/field/image/plants/cutleaf-philodendron-r_0.jpg?itok=YwV1sD3N,https://www.aspca.org//pet-care/animal-poison-control/toxic-and-non-toxic-plants/mexican-breadfruit,FALSE,FALSE,FALSE,"Oral irritation, intense burning and irritation of mouth, tongue and lips, excessive drooling, vomiting, difficulty swallowing."
Mexican Firecracker,Echeveria Pulinata,,Crassulaceae,https://www.aspca.org/sites/default/files/styles/medium_image_300x200/public/default_images/imageunavailable_0.jpg?itok=JCCt_uvE,https://www.aspca.org//pet-care/animal-poison-control/toxic-and-non-toxic-plants/mexican-firecracker,TRUE,TRUE,FALSE,null
Mexican Rosettes,Echevaria,,Crassulaceae,https://www.aspca.org/sites/default/files/styles/medium_image_300x200/public/default_images/imageunavailable_0.jpg?itok=JCCt_uvE,https://www.aspca.org//pet-care/animal-poison-control/toxic-and-non-toxic-plants/mexican-rosettes,TRUE,TRUE,FALSE,null
Mexican Snowballs,Echevaria,,Crassulaceae,https://www.aspca.org/sites/default/files/styles/medium_image_300x200/public/default_images/imageunavailable_0.jpg?itok=JCCt_uvE,https://www.aspca.org//pet-care/animal-poison-control/toxic-and-non-toxic-plants/mexican-snowballs,TRUE,TRUE,FALSE,null
Milfoil,Achillea millefolium,Yarrow,Asteraceae,https://www.aspca.org/sites/default/files/styles/medium_image_300x200/public/field/image/plants/milfoil-r.jpg?itok=mIerbdsy,https://www.aspca.org//pet-care/animal-poison-control/toxic-and-non-toxic-plants/milfoil,FALSE,FALSE,FALSE,"Vomiting, diarrhea, depression, anorexia, hypersalivation"
Milkweed,Asclepias species,,Asclepiadaceae,https://www.aspca.org/sites/default/files/styles/medium_image_300x200/public/default_images/imageunavailable_0.jpg?itok=JCCt_uvE,https://www.aspca.org//pet-care/animal-poison-control/toxic-and-non-toxic-plants/milkweed,FALSE,FALSE,FALSE,"Vomiting, profound depression, weakness, anorexia, and diarrhea are common; may be followed by seizures, difficulty breathing, rapid, weak pulse, dilated pupils, kidney or liver failure, coma, respiratory paralysis and death"
Miniature Date Palm,Phoenix robellinii,"Pygmy Date Palm, Robellini Palm",Arecaceae,https://www.aspca.org/sites/default/files/styles/medium_image_300x200/public/default_images/imageunavailable_0.jpg?itok=JCCt_uvE,https://www.aspca.org//pet-care/animal-poison-control/toxic-and-non-toxic-plants/miniature-date-palm,TRUE,TRUE,FALSE,null
Miniature Fish Tail,Chamaedorea elegans,Parlor Palm,Palmae,https://www.aspca.org/sites/default/files/styles/medium_image_300x200/public/default_images/imageunavailable_0.jpg?itok=JCCt_uvE,https://www.aspca.org//pet-care/animal-poison-control/toxic-and-non-toxic-plants/miniature-fish-tail,TRUE,TRUE,FALSE,null
Miniature Maranta,Calathea micans,,Saxifragaceae,https://www.aspca.org/sites/default/files/styles/medium_image_300x200/public/default_images/imageunavailable_0.jpg?itok=JCCt_uvE,https://www.aspca.org//pet-care/animal-poison-control/toxic-and-non-toxic-plants/miniature-maranta,TRUE,TRUE,FALSE,null
Miniature Marble Plant,Neoregelia spectabilis,null,Bromeliaceae,https://www.aspca.org/sites/default/files/styles/medium_image_300x200/public/field/image/plants/fingernail-plant-r_1.jpg?itok=Na1s201L,https://www.aspca.org//pet-care/animal-poison-control/toxic-and-non-toxic-plants/miniature-marble-plant,TRUE,TRUE,FALSE,null
"Mistletoe ""American""",Phoradendron flavescens,American Mistletoe,Viscaceae,https://www.aspca.org/sites/default/files/styles/medium_image_300x200/public/field/image/plants/mistletoe-american-r.jpg?itok=XR1rUvwe,https://www.aspca.org//pet-care/animal-poison-control/toxic-and-non-toxic-plants/mistletoe-american,FALSE,FALSE,FALSE,"Gastrointestinal disorders, cardiovascular collapse, dyspnea, bradycardia, erratic behavior, (hallucinogenic in humans). Vomiting, diarrhea, low blood pressure (rare)."
Mistletoe Cactus,Rhipsalis cassutha,,Cactaceae,https://www.aspca.org/sites/default/files/styles/medium_image_300x200/public/default_images/imageunavailable_0.jpg?itok=JCCt_uvE,https://www.aspca.org//pet-care/animal-poison-control/toxic-and-non-toxic-plants/mistletoe-cactus,TRUE,TRUE,FALSE,null
Mock Azalea,Adenium obesum,"Desert Rose, Desert Azalea, Sabi Star, Impala Lily, Kudu Lily",Apocynaceae,https://www.aspca.org/sites/default/files/styles/medium_image_300x200/public/field/image/plants/desert-azalea-r_0.jpg?itok=JPHpXIof,https://www.aspca.org//pet-care/animal-poison-control/toxic-and-non-toxic-plants/mock-azalea,FALSE,FALSE,FALSE,"Vomiting, diarrhea, anorexia, depression, irregular heart beat, death"
Mockernut Hickory,Carya tomentosa,Squarenut,Juglandaceae,https://www.aspca.org/sites/default/files/styles/medium_image_300x200/public/default_images/imageunavailable_0.jpg?itok=JCCt_uvE,https://www.aspca.org//pet-care/animal-poison-control/toxic-and-non-toxic-plants/mockernut-hickory,TRUE,TRUE,TRUE,null
