name,sci_name,common_names,family,image_url,aspca_url,non_toxicity_cats,non_toxicity_dogs,non_toxicity_horses,clinical_signs
Cutleaf Philodendron,Monstera deliciosa,"Hurricane Plant, Swiss Cheese Plant, Ceriman, Mexican Breadfruit, Split-leaf Philodendron, Window Leaf Plant",Araceae,https://www.aspca.org/sites/default/files/styles/medium_image_300x200/public/field/image/plants/cutleaf-philodendron-r.jpg?itok=q0nuAtMl,https://www.aspca.org//pet-care/animal-poison-control/toxic-and-non-toxic-plants/cutleaf-philodendron,FALSE,FALSE,FALSE,"Oral irritation, intense burning and irritation of mouth, tongue and lips, excessive drooling, vomiting, difficulty swallowing."
Cycads,Cycas and Zamia species,"Sago Palm, Fern Palm",Cycadaceae,https://www.aspca.org/sites/default/files/styles/medium_image_300x200/public/field/image/plants/cycads-r.jpg?itok=I7gOluo_,https://www.aspca.org//pet-care/animal-poison-control/toxic-and-non-toxic-plants/cycads,FALSE,FALSE,FALSE,"Vomiting (may be bloody), dark stools, jaundice, increased thirst, bloody diarrhea, bruising, liver failure, death. 1-2 seeds can be fatal."
Cyclamen,Cyclamen spp,Sowbread,Primulaceae,https://www.aspca.org/sites/default/files/styles/medium_image_300x200/public/field/image/plants/cyclamen-2-r.jpg?itok=U0jcTkW3,https://www.aspca.org//pet-care/animal-poison-control/toxic-and-non-toxic-plants/cyclamen,FALSE,FALSE,FALSE,"Salivation, vomiting, diarrhea. Following large ingestions of tubers: heart rhythm abnormalities, seizures, death"
Cyrtudeira,Episcia reptans,"Flame African Violet, Frosty, Flame, Moss agate, Lady Lou, Red African Violet, Acajou",Gesneriaceae,https://www.aspca.org/sites/default/files/styles/medium_image_300x200/public/default_images/imageunavailable_0.jpg?itok=JCCt_uvE,https://www.aspca.org//pet-care/animal-poison-control/toxic-and-non-toxic-plants/cyrtudeira,TRUE,TRUE,FALSE,null
Daffodil,Narcissus spp,"Narcissus, Jonquil, Paper White",Amaryllidaceae,https://www.aspca.org/sites/default/files/styles/medium_image_300x200/public/field/image/plants/daffodil-r.jpg?itok=AL_7AwrI,https://www.aspca.org//pet-care/animal-poison-control/toxic-and-non-toxic-plants/daffodil,FALSE,FALSE,FALSE,"Vomiting, salvation, diarrhea; large ingestions cause convulsions, low blood pressure, tremors and cardiac arrhythmias. Bulbs are the most poisonous part."
Dahlia,Dahlia species,Many varieties,Compositae,https://www.aspca.org/sites/default/files/styles/medium_image_300x200/public/field/image/plants/dahlia-r.jpg?itok=T7bHOgCt,https://www.aspca.org//pet-care/animal-poison-control/toxic-and-non-toxic-plants/dahlia,FALSE,FALSE,FALSE,"Mild gastrointestinal signs, mild dermatitis"
Dainty Rabbits-Foot Fern,Davallia fejeensis,"Lacy Paw, Lacy Hare's Foot",Davalliaceae,https://www.aspca.org/sites/default/files/styles/medium_image_300x200/public/default_images/imageunavailable_0.jpg?itok=JCCt_uvE,https://www.aspca.org//pet-care/animal-poison-control/toxic-and-non-toxic-plants/dainty-rabbits-foot-fern,TRUE,TRUE,TRUE,null
Daisy,Chrysanthemum species,"Chrysanthemum, Mum",Compositae,https://www.aspca.org/sites/default/files/styles/medium_image_300x200/public/chrysanthemum-r.jpg?itok=k2oPKH9x,https://www.aspca.org//pet-care/animal-poison-control/toxic-and-non-toxic-plants/daisy,FALSE,FALSE,FALSE,"Vomiting, diarrhea, hypersalivation, incoordination, dermatitis"
Dallas Fern,Nephrolepis biserrata,Bold Sword Fern,Dryopteridaceae,https://www.aspca.org/sites/default/files/styles/medium_image_300x200/public/field/image/plants/dallas-fern-r.jpg?itok=yjworGbl,https://www.aspca.org//pet-care/animal-poison-control/toxic-and-non-toxic-plants/dallas-fern,TRUE,TRUE,TRUE,null
Dancing Doll Orchid,Oncidium flexuosum,,Orchidaceae,https://www.aspca.org/sites/default/files/styles/medium_image_300x200/public/default_images/imageunavailable_0.jpg?itok=JCCt_uvE,https://www.aspca.org//pet-care/animal-poison-control/toxic-and-non-toxic-plants/dancing-doll-orchid,TRUE,TRUE,FALSE,null
Day Lilies (many varieties),Hemerocallis spp.,null,Liliaceae,https://www.aspca.org/sites/default/files/styles/medium_image_300x200/public/field/image/plants/day-lily-r.jpg?itok=K8g4CvCe,https://www.aspca.org//pet-care/animal-poison-control/toxic-and-non-toxic-plants/day-lilies-many-varieties,FALSE,TRUE,FALSE,"Cats: kidney failure. Cows: Incoordination, paresis, blindness, death."
Deadly Nightshade,Solanum spp,"Nightshade, Black Nightshade, European Bittersweet, Climbing Nightshade",Solanaceae,https://www.aspca.org/sites/default/files/styles/medium_image_300x200/public/field/image/plants/deadly-nightshade-r.jpg?itok=mUJ4pAZX,https://www.aspca.org//pet-care/animal-poison-control/toxic-and-non-toxic-plants/deadly-nightshade,FALSE,FALSE,FALSE,"Hypersalivation, inappetence, severe gastrointestinal upset, diarrhea, drowsiness, CNS depression, confusion, behavioral change, weakness, dilated pupils, slow heart rate."
Desert Azalea,Adenium obesum,"Desert Rose, Mock Azalea, Sabi Star, Impala Lily, Kudu Lily",Apocynaceae,https://www.aspca.org/sites/default/files/styles/medium_image_300x200/public/field/image/plants/desert-azalea-r.jpg?itok=tkJzYgmQ,https://www.aspca.org//pet-care/animal-poison-control/toxic-and-non-toxic-plants/desert-azalea,FALSE,FALSE,FALSE,"Vomiting, diarrhea, anorexia, depression, irregular heart beat, death"
Desert Rose,Adenium obesum,"Desert Azalea, Mock Azalea, Sabi Star, Impala Lily, Kudu Lily",Apocynaceae,https://www.aspca.org/sites/default/files/styles/medium_image_300x200/public/field/image/plants/desert-azalea-r.jpg?itok=tkJzYgmQ,https://www.aspca.org//pet-care/animal-poison-control/toxic-and-non-toxic-plants/desert-rose,FALSE,FALSE,FALSE,"Vomiting, diarrhea, anorexia, depression, irregular heart beat, death"
Desert Trumpet,Eriogonium inflatum,null,Polygonaceae,https://www.aspca.org/sites/default/files/styles/medium_image_300x200/public/field/image/plants/desert-trumpet-r.jpg?itok=8DFwjWTo,https://www.aspca.org//pet-care/animal-poison-control/toxic-and-non-toxic-plants/desert-trumpet,TRUE,TRUE,TRUE,null
Devil's Backbone,Kalanchoe tubiflora,"Mother-In-Law-Plant, Kalanchoe, Chandelier Plant, Mother of Millions",Crassulaceae,https://www.aspca.org/sites/default/files/styles/medium_image_300x200/public/default_images/imageunavailable_0.jpg?itok=JCCt_uvE,https://www.aspca.org//pet-care/animal-poison-control/toxic-and-non-toxic-plants/devils-backbone,FALSE,FALSE,FALSE,"Vomiting, diarrhea, abnormal heart rhythm (rare)."
Devils Ivy,Epipremnum aureum,"Pothos, Golden Pothos, Taro Vine, Ivy Arum",Araceae,https://www.aspca.org/sites/default/files/styles/medium_image_300x200/public/field/image/plants/devils-ivy-2-r.jpg?itok=VyaB4WyJ,https://www.aspca.org//pet-care/animal-poison-control/toxic-and-non-toxic-plants/devils-ivy,FALSE,FALSE,FALSE,"Oral irritation, intense burning and irritation of mouth, tongue and lips, excessive drooling, vomiting, difficulty swallowing."
Dichelostemma,Dichelostemma species,Several varieties,Amaryllidaceae,https://www.aspca.org/sites/default/files/styles/medium_image_300x200/public/field/image/plants/dichelostemma-r.jpg?itok=WsCLhbuP,https://www.aspca.org//pet-care/animal-poison-control/toxic-and-non-toxic-plants/dichelostemma,TRUE,TRUE,TRUE,null
Dichorisandra Reginae,Dichorisandra reginae,Queen's Spiderwort,Commelinaceae,https://www.aspca.org/sites/default/files/styles/medium_image_300x200/public/default_images/imageunavailable_0.jpg?itok=JCCt_uvE,https://www.aspca.org//pet-care/animal-poison-control/toxic-and-non-toxic-plants/dichorisandra-reginae,TRUE,TRUE,FALSE,null
Dieffenbachia,Dieffenbachia,"Charming Dieffenbachia, Giant Dumb Cane, Tropic Snow, Dumbcane, Exotica, Spotted Dumb Cane, Exotica Perfection",Araceae,https://www.aspca.org/sites/default/files/styles/medium_image_300x200/public/field/image/plants/dumbcane-r.jpg?itok=elybOvHm,https://www.aspca.org//pet-care/animal-poison-control/toxic-and-non-toxic-plants/dieffenbachia,FALSE,FALSE,FALSE,"Oral irritation, intense burning and irritation of mouth , tongue and lips, excessive drooling, vomiting, difficulty swallowing"
Dinteranthus Vanzylii,Dinteranthus,null,Aizoaceae,https://www.aspca.org/sites/default/files/styles/medium_image_300x200/public/field/image/plants/dinteranthus-r.jpg?itok=o5ph5MmP,https://www.aspca.org//pet-care/animal-poison-control/toxic-and-non-toxic-plants/dinteranthus-vanzylii,TRUE,TRUE,FALSE,null
Dock,Rumex sp.,Sorrel,Polygonaceae,https://www.aspca.org/sites/default/files/styles/medium_image_300x200/public/field/image/plants/dock-r.jpg?itok=rPWkishR,https://www.aspca.org//pet-care/animal-poison-control/toxic-and-non-toxic-plants/dock,FALSE,FALSE,FALSE,"Kidney failure, tremors, salivation."
Dog Daisy,Achillea millefolium,Dog Fennel,Compositae,https://www.aspca.org/sites/default/files/styles/medium_image_300x200/public/field/image/plants/dog-daisy-r.jpg?itok=LLg1LmD0,https://www.aspca.org//pet-care/animal-poison-control/toxic-and-non-toxic-plants/dog-daisy,FALSE,FALSE,FALSE,"Increased urination, vomiting, diarrhea, dermatitis."
Dog Hobble,Leucothoe sp.,"Dog Laurel, Fetter Bush, Black Laurel",Ericaceae,https://www.aspca.org/sites/default/files/styles/medium_image_300x200/public/field/image/plants/dog-hobble-r.jpg?itok=1Hm543NR,https://www.aspca.org//pet-care/animal-poison-control/toxic-and-non-toxic-plants/dog-hobble,FALSE,FALSE,FALSE,"Vomiting, diarrhea, depression, cardiovascular collapse, hypersalivation, weakness, coma, low blood pressure, death. Ingestion of a few leaves can cause serious problems."
Dogbane Hemp,Apocynum,"Bitterroot, Indian Hemp",Apocynaceae,https://www.aspca.org/sites/default/files/styles/medium_image_300x200/public/field/image/plants/bitter-root-r_0.jpg?itok=2wXqmQhF,https://www.aspca.org//pet-care/animal-poison-control/toxic-and-non-toxic-plants/dogbane-hemp,FALSE,FALSE,FALSE,"Diarrhea (possibly with blood), slow heart rate, weakness"
Dracaena,Dracaena spp.,"Corn Plant, Cornstalk Plant, Dragon Tree, Ribbon Plant",Agavaceae,https://www.aspca.org/sites/default/files/styles/medium_image_300x200/public/field/image/plants/dracaena-r.jpg?itok=Yv51Sqo6,https://www.aspca.org//pet-care/animal-poison-control/toxic-and-non-toxic-plants/dracaena,FALSE,FALSE,FALSE,"Vomiting (occasionally with blood), depression, anorexia, hypersalivation, dilated pupils (cats)."
Duffii Fern,Nephrolepsis cordifolia 'duffii',"Duffy Fern, Lemon Button Fern",Nephrolepidaceae,https://www.aspca.org/sites/default/files/styles/medium_image_300x200/public/field/image/plants/duffii-fern-r.jpg?itok=nFH-4oCp,https://www.aspca.org//pet-care/animal-poison-control/toxic-and-non-toxic-plants/duffii-fern,TRUE,TRUE,FALSE,null
Dumbcane,Dieffenbachia,"Charming Dieffenbachia, Giant Dumb Cane, Tropic Snow, Exotica, Spotted Dumb Cane, Exotica Perfection, Dieffenbachia",Araceae,https://www.aspca.org/sites/default/files/styles/medium_image_300x200/public/field/image/plants/dumbcane-r.jpg?itok=elybOvHm,https://www.aspca.org//pet-care/animal-poison-control/toxic-and-non-toxic-plants/dumbcane,FALSE,FALSE,FALSE,"Oral irritation, intense burning and irritation of mouth , tongue and lips, excessive drooling, vomiting, difficulty swallowing."
Dwarf Date Palm,Phoenix acaulis,null,Palmae,https://www.aspca.org/sites/default/files/styles/medium_image_300x200/public/field/image/plants/dwarf-date-palm-r.jpg?itok=CSheS_jW,https://www.aspca.org//pet-care/animal-poison-control/toxic-and-non-toxic-plants/dwarf-date-palm,TRUE,TRUE,FALSE,null
Dwarf Feather Palm,Nephrolepis exaltata,null,Nephrolepidaceae,https://www.aspca.org/sites/default/files/styles/medium_image_300x200/public/field/image/plants/feather-palm-r.jpg?itok=D6oFKTxN,https://www.aspca.org//pet-care/animal-poison-control/toxic-and-non-toxic-plants/dwarf-feather-palm,TRUE,TRUE,FALSE,null
Dwarf Palm,Chamaedorea elegans,"Good Luck palm, Parlor palm",Palmae,https://www.aspca.org/sites/default/files/styles/medium_image_300x200/public/field/image/plants/good-luck-palm-r.jpg?itok=ntv9y8-g,https://www.aspca.org//pet-care/animal-poison-control/toxic-and-non-toxic-plants/dwarf-palm,TRUE,TRUE,FALSE,null
Dwarf Poinciana,Caesalpinia pulcherrima,"Barbados Pride, Peacock Flower",Fabaceae,https://www.aspca.org/sites/default/files/styles/medium_image_300x200/public/field/image/plants/peacock-flower-r.jpg?itok=XCQhK1ED,https://www.aspca.org//pet-care/animal-poison-control/toxic-and-non-toxic-plants/dwarf-poinciana,FALSE,FALSE,FALSE,Vomiting and diarrhea.
Dwarf Rose-Stripe Star,Cryptanthus bivattus minor,,Bromelaceae,https://www.aspca.org/sites/default/files/styles/medium_image_300x200/public/default_images/imageunavailable_0.jpg?itok=JCCt_uvE,https://www.aspca.org//pet-care/animal-poison-control/toxic-and-non-toxic-plants/dwarf-rose-stripe-star,TRUE,TRUE,FALSE,null
Dwarf Royal Palm,Veitchia merillii,,Arecaceae,https://www.aspca.org/sites/default/files/styles/medium_image_300x200/public/default_images/imageunavailable_0.jpg?itok=JCCt_uvE,https://www.aspca.org//pet-care/animal-poison-control/toxic-and-non-toxic-plants/dwarf-royal-palm,TRUE,TRUE,FALSE,null
Dwarf Whitman Fern,Nephrolepsis cordifolia plumosa,,Nephrolepidaceae,https://www.aspca.org/sites/default/files/styles/medium_image_300x200/public/default_images/imageunavailable_0.jpg?itok=JCCt_uvE,https://www.aspca.org//pet-care/animal-poison-control/toxic-and-non-toxic-plants/dwarf-whitman-fern,TRUE,TRUE,FALSE,null
Earth Star,Cryptanthus bivattus minor,"Starfish plant, Green earth star, Vary-leaf star",Bromeliaceae,https://www.aspca.org/sites/default/files/styles/medium_image_300x200/public/field/image/plants/earth-star-r.jpg?itok=-TECobfj,https://www.aspca.org//pet-care/animal-poison-control/toxic-and-non-toxic-plants/earth-star,TRUE,TRUE,FALSE,null
Easter Cattleya,Cattleya mossiae,Easter Orchid,Orchidaceae,https://www.aspca.org/sites/default/files/styles/medium_image_300x200/public/field/image/plants/easter-cattleya-r.jpg?itok=U122648F,https://www.aspca.org//pet-care/animal-poison-control/toxic-and-non-toxic-plants/easter-cattleya,TRUE,TRUE,FALSE,null
Easter Daisy,Townsendia sevicea,null,Asteraceae,https://www.aspca.org/sites/default/files/styles/medium_image_300x200/public/field/image/plants/easter-daisy-r.jpg?itok=OuRPHAT5,https://www.aspca.org//pet-care/animal-poison-control/toxic-and-non-toxic-plants/easter-daisy,TRUE,TRUE,TRUE,null
Easter Lily,Lilium longiflorum,null,Liliaceae,https://www.aspca.org/sites/default/files/styles/medium_image_300x200/public/field/image/plants/easter-lily-1-r.jpg?itok=vkjorwDu,https://www.aspca.org//pet-care/animal-poison-control/toxic-and-non-toxic-plants/easter-lily,FALSE,TRUE,TRUE,"Vomiting, inappetence, lethargy, kidney failure, and death is possible. Cats are only species known to be affected."
Easter Lily Cactus,Echinopsis multiplex,,Cactaceae,https://www.aspca.org/sites/default/files/styles/medium_image_300x200/public/default_images/imageunavailable_0.jpg?itok=JCCt_uvE,https://www.aspca.org//pet-care/animal-poison-control/toxic-and-non-toxic-plants/easter-lily-cactus,TRUE,TRUE,FALSE,null
Easter Orchid,Cattleya mossiae,Easter Cattleya,Orchidaceae,https://www.aspca.org/sites/default/files/styles/medium_image_300x200/public/field/image/plants/easter-cattleya-r.jpg?itok=U122648F,https://www.aspca.org//pet-care/animal-poison-control/toxic-and-non-toxic-plants/easter-orchid,TRUE,TRUE,FALSE,null
Easter Rose,Helleborus niger,"Hellebore, Christmas Rose, Lenten Rose",Ranunculaceae,https://www.aspca.org/sites/default/files/styles/medium_image_300x200/public/field/image/plants/christmas-rose-r.jpg?itok=cqfmgqS-,https://www.aspca.org//pet-care/animal-poison-control/toxic-and-non-toxic-plants/easter-rose,FALSE,FALSE,FALSE,"Drooling, abdominal pain and diarrhea, colic, depression."
Eastern Star,Dianthus,null,Caryophyllaceae,https://www.aspca.org/sites/default/files/styles/medium_image_300x200/public/field/image/plants/eastern-star-r.jpg?itok=cILpF0KB,https://www.aspca.org//pet-care/animal-poison-control/toxic-and-non-toxic-plants/eastern-star,FALSE,FALSE,FALSE,null
Edible Banana,Musa acuminata,null,Musaceae,https://www.aspca.org/sites/default/files/styles/medium_image_300x200/public/field/image/plants/banana-r.jpg?itok=EVDCwEtU,https://www.aspca.org//pet-care/animal-poison-control/toxic-and-non-toxic-plants/edible-banana,TRUE,TRUE,TRUE,null
Elephant Ears,Caladium hortulanum,"Caladium, Taro, Pai, Ape, Cape, Via, Via sori, Malanga",Araceae,https://www.aspca.org/sites/default/files/styles/medium_image_300x200/public/field/image/plants/elephant-ears-r.jpg?itok=Pi8zHwaI,https://www.aspca.org//pet-care/animal-poison-control/toxic-and-non-toxic-plants/elephant-ears,FALSE,FALSE,FALSE,"Oral irritation, intense burning and irritation of the mouth, lips, tongue, excessive drooling, vomiting, difficulty in swallowing."
Elephant Ears,Colocasia esculenta,"Caladium, Malanga",Araceae,https://www.aspca.org/sites/default/files/styles/medium_image_300x200/public/field/image/plants/elephant-ears-r.jpg?itok=Pi8zHwaI,https://www.aspca.org//pet-care/animal-poison-control/toxic-and-non-toxic-plants/elephant-ears-0,FALSE,FALSE,FALSE,"Oral irritation, intense burning and irritation of mouth, tongue and lips, excessive drooling, vomiting, difficulty swallowing."
Elephant-Ear Begonia,Begonia scharfii,,Begoniaceae,https://www.aspca.org/sites/default/files/styles/medium_image_300x200/public/default_images/imageunavailable_0.jpg?itok=JCCt_uvE,https://www.aspca.org//pet-care/animal-poison-control/toxic-and-non-toxic-plants/elephant-ear-begonia,TRUE,TRUE,FALSE,Non-toxic
Emerald Feather,Asparagus densiflorus,"Emerald Fern, Asparagus, Asparagus fern, Sprengeri fern, Plumosa fern, Lace fern, Racemose asparagus, Shatavari",Liliaceae,https://www.aspca.org/sites/default/files/styles/medium_image_300x200/public/field/image/plants/emerald-feather-r.jpg?itok=SEHPov3d,https://www.aspca.org//pet-care/animal-poison-control/toxic-and-non-toxic-plants/emerald-feather,FALSE,FALSE,FALSE,"Allergic dermatitis with repeated dermal exposure. Berry ingestion could result in gastric upset (vomiting, abdominal pain, or diarrhea)."
Emerald Ripple Peperomia,Peperomia caperata,"Green ripple peperomia, Little fantasy peperpmia",Piperaceae,https://www.aspca.org/sites/default/files/styles/medium_image_300x200/public/default_images/imageunavailable_0.jpg?itok=JCCt_uvE,https://www.aspca.org//pet-care/animal-poison-control/toxic-and-non-toxic-plants/emerald-ripple-peperomia,TRUE,TRUE,FALSE,null
English Hawthorn,Crataegus laevigata,"Midland hawthorn, Smooth hawthorn",Rosaceae,https://www.aspca.org/sites/default/files/styles/medium_image_300x200/public/default_images/imageunavailable_0.jpg?itok=JCCt_uvE,https://www.aspca.org//pet-care/animal-poison-control/toxic-and-non-toxic-plants/english-hawthorn,TRUE,TRUE,TRUE,null
English Holly,Ilex aquifolium,"European Holly, Oregon Holly, Inkberry, Winterberry, American Holly",Aquifoliaceae,https://www.aspca.org/sites/default/files/styles/medium_image_300x200/public/field/image/plants/english-holly-r.jpg?itok=5hjEx9q-,https://www.aspca.org//pet-care/animal-poison-control/toxic-and-non-toxic-plants/english-holly,FALSE,FALSE,FALSE,"Vomiting, diarrhea and depression. Leaves and berries are low toxicity."
English Ivy,Hedera helix,"Branching Ivy, Glacier Ivy, Needlepoint Ivy, Sweetheart Ivy, California Ivy",Araliaceae,https://www.aspca.org/sites/default/files/styles/medium_image_300x200/public/field/image/plants/english-ivy-r.jpg?itok=OkBe7NIq,https://www.aspca.org//pet-care/animal-poison-control/toxic-and-non-toxic-plants/english-ivy,FALSE,FALSE,FALSE,"Vomiting, abdominal pain, hypersalivation, diarrhea. Foliage is more toxic than berries"
English Yew,Taxus baccata,"Western Yew, Pacific Yew, Japanese Yew, Anglo-Japanese Yew",Taxaceae,https://www.aspca.org/sites/default/files/styles/medium_image_300x200/public/field/image/plants/japanese-yew-r.jpg?itok=xoes_oCs,https://www.aspca.org//pet-care/animal-poison-control/toxic-and-non-toxic-plants/english-yew,FALSE,FALSE,FALSE,"Tremors, difficulty breathing, vomiting, seizures (dogs), sudden death from acute heart failure."
Episcia,Episcia dianthiflora,"Lace-Flower Vine, Chocolate Soldier",Gesneriaceae,https://www.aspca.org/sites/default/files/styles/medium_image_300x200/public/field/image/plants/chocolate-soldier-r.jpg?itok=qk7l1baw,https://www.aspca.org//pet-care/animal-poison-control/toxic-and-non-toxic-plants/episcia,TRUE,TRUE,FALSE,null
Eucalyptus,Eucalyptus species,Many cultivars,Myrtaceae,https://www.aspca.org/sites/default/files/styles/medium_image_300x200/public/field/image/plants/eucalyptus-r.jpg?itok=R47aOUCa,https://www.aspca.org//pet-care/animal-poison-control/toxic-and-non-toxic-plants/eucalyptus,FALSE,FALSE,FALSE,"Salivation, vomiting, diarrhea, depression, weakness"
European Bittersweet,Solanum dulcamara,"Climbing Nightshade, Deadly Nightshade",Solanaceae,https://www.aspca.org/sites/default/files/styles/medium_image_300x200/public/field/image/plants/european-bittersweet-r.jpg?itok=4rxram0S,https://www.aspca.org//pet-care/animal-poison-control/toxic-and-non-toxic-plants/european-bittersweet,FALSE,FALSE,FALSE,"Vomiting, diarrhea - common. Drowsiness, low blood pressure, low heart rate - uncommon."
European Holly,Ilex aquifolium,"European Holly, Oregon Holly, Inkberry, Winterberry, American Holly, English Holly",Aquifoliaceae,https://www.aspca.org/sites/default/files/styles/medium_image_300x200/public/field/image/plants/holly-r.jpg?itok=JGyblujw,https://www.aspca.org//pet-care/animal-poison-control/toxic-and-non-toxic-plants/european-holly,FALSE,FALSE,FALSE,"Vomiting, diarrhea and depression. Leaves and berries are low toxicity."
Everlasting Pea,Lathyrus latifolius,"Sweet Pea, Perennial Pea",Fabaceae,https://www.aspca.org/sites/default/files/styles/medium_image_300x200/public/field/image/plants/sweet-pea-r.jpg?itok=UIrxOmuQ,https://www.aspca.org//pet-care/animal-poison-control/toxic-and-non-toxic-plants/everlasting-pea,FALSE,FALSE,FALSE,"Weakness, lethargy, pacing, head pressing, tremors, seizures and possibly death."
Exotica,Dieffenbachia amoena,"Charming Dieffenbachia, Giant Dumb Cane, Tropic Snow, Dumbcane, Spotted Dumb Cane, Exotica Perfection, Dieffenbachia",Araceae,https://www.aspca.org/sites/default/files/styles/medium_image_300x200/public/field/image/plants/exotica-r.jpg?itok=U1AiXfwJ,https://www.aspca.org//pet-care/animal-poison-control/toxic-and-non-toxic-plants/exotica,FALSE,FALSE,FALSE,"Oral irritation, intense burning and irritation of mouth , tongue and lips, excessive drooling, vomiting, difficulty swallowing"
Fairy Fountain,Celosia cristata,"Feathered Amaranth, Woolflower",Amaranthaeceae,https://www.aspca.org/sites/default/files/styles/medium_image_300x200/public/default_images/imageunavailable_0.jpg?itok=JCCt_uvE,https://www.aspca.org//pet-care/animal-poison-control/toxic-and-non-toxic-plants/fairy-fountain,TRUE,TRUE,FALSE,null
False Aralia,Dizygotheca elegantissima,null,Araliaceae,https://www.aspca.org/sites/default/files/styles/medium_image_300x200/public/field/image/plants/false-aralia-r.jpg?itok=dX31siqf,https://www.aspca.org//pet-care/animal-poison-control/toxic-and-non-toxic-plants/false-aralia,TRUE,TRUE,FALSE,null
False Bittersweet,Celastrus scandens,American Bittersweet,Celastraceae,https://www.aspca.org/sites/default/files/styles/medium_image_300x200/public/field/image/plants/american-bittersweet-r.jpg?itok=K-7x7p2u,https://www.aspca.org//pet-care/animal-poison-control/toxic-and-non-toxic-plants/false-bittersweet,FALSE,FALSE,FALSE,"Vomiting, diarrhea"
False Queen Anne’s Lace,Ammi majus,"Bishop's Weed, Greater Ammi",Apiaceae,https://www.aspca.org/sites/default/files/styles/medium_image_300x200/public/field/image/plants/greater-ammi-r.jpg?itok=mCO6ushm,https://www.aspca.org//pet-care/animal-poison-control/toxic-and-non-toxic-plants/false-queen-annes-lace,FALSE,FALSE,FALSE,Photosensitization (ulcerative and exudative dermatitis)
Fan Tufted Palm,Rhapis flabelliformis,Lady Palm,Araceae,https://www.aspca.org/sites/default/files/styles/medium_image_300x200/public/field/image/plants/fan-tufted-palm-r.jpg?itok=t36q-ICT,https://www.aspca.org//pet-care/animal-poison-control/toxic-and-non-toxic-plants/fan-tufted-palm,TRUE,TRUE,FALSE,null
Feather Geranium,Ambrosia mexicana,"Jerusalem Oak, Ambrosia Mexicana",Chenopodiaceae,https://www.aspca.org/sites/default/files/styles/medium_image_300x200/public/field/image/plants/ambrosia-mexicana-r.jpg?itok=Mqy9Lq0f,https://www.aspca.org//pet-care/animal-poison-control/toxic-and-non-toxic-plants/feather-geranium,FALSE,FALSE,FALSE,"Vomiting, anorexia, depression"
Feather Palm,Nephrolepis exaltata,null,Nephrolepidaceae,https://www.aspca.org/sites/default/files/styles/medium_image_300x200/public/field/image/plants/feather-palm-r.jpg?itok=D6oFKTxN,https://www.aspca.org//pet-care/animal-poison-control/toxic-and-non-toxic-plants/feather-palm,TRUE,TRUE,FALSE,null
Fern Palm,Cycas species,"Sago Palm, Cycads",Cycadaceae,https://www.aspca.org/sites/default/files/styles/medium_image_300x200/public/field/image/plants/sago-palm-r.jpg?itok=ww2JjLQ_,https://www.aspca.org//pet-care/animal-poison-control/toxic-and-non-toxic-plants/fern-palm,FALSE,FALSE,FALSE,"Vomiting (may be bloody), dark stools, jaundice, increased thirst, bloody diarrhea, bruising, liver failure, death. 1-2 seeds can be fatal."
Fetter Bush,Leucothoe sp.,"Dog Laurel, Dog Hobble, Black Laurel",Ericaceae,https://www.aspca.org/sites/default/files/styles/medium_image_300x200/public/field/image/plants/dog-hobble-r.jpg?itok=1Hm543NR,https://www.aspca.org//pet-care/animal-poison-control/toxic-and-non-toxic-plants/fetter-bush,FALSE,FALSE,FALSE,"Vomiting, diarrhea, depression, cardiovascular collapse, hypersalivation, weakness, coma, low blood pressure, death. Ingestion of a few leaves can cause serious problems."
