family,scientific_name,name,non_toxicity_cats,non_toxicity_dogs,non_toxicity_horses,additional_common_names,clinical_signs,url,image_url
 Umbelliferae, Conium maculatum,Poison Hemlock,FALSE,FALSE,FALSE," Poison Parsley, Spotted Hemlock, Winter Fern, California Fern, Nebraska Fern, Deadly Hemlock"," Infrequently causing poisonings, this plant is not likely to be consumed unless other forage is not available. A number of toxic alkaloids are contained within the plant, and the content varies depending on the stage of maturity or repoduction, and climactic conditions. As the plant dries out, the toxic potential disappears. Clinical signs can develop within minutes after ingestion, and may include central nervous system excitation, muscle tremors, incoordination, excessive salivation, frequent bowel movements and urination, abdominal pain, and increased respiratory rate. As the syndrome advances, weakness progresses to muscular paralysis. Death is possible due to respiratory paralysis.",https://www.aspca.org//pet-care/animal-poison-control/toxic-and-non-toxic-plants/poison-hemlock,https://www.aspca.org/sites/default/files/styles/medium_image_300x200/public/field/image/plants/poison-hemlock-r.jpg?itok=dn3iVLzL
 Anacardiaceae, Toxicodendron species,Poison Ivy,TRUE,TRUE,TRUE," poison oak, poison sumac"," Allergic dermatitis in humans, usually not a problem in animals.",https://www.aspca.org//pet-care/animal-poison-control/toxic-and-non-toxic-plants/poison-ivy,https://www.aspca.org/sites/default/files/styles/medium_image_300x200/public/default_images/imageunavailable_0.jpg?itok=JCCt_uvE
 Anacardiaceae, Toxicodendron species,Poison Oak,TRUE,TRUE,TRUE," Similar: Poison Ivy, Poison Sumac"," Allergic dermatitis in humans, usually not a problem in animals.",https://www.aspca.org//pet-care/animal-poison-control/toxic-and-non-toxic-plants/poison-oak,https://www.aspca.org/sites/default/files/styles/medium_image_300x200/public/default_images/imageunavailable_0.jpg?itok=JCCt_uvE
 Apiaceae, Cicuta maculata,Poison Parsnip,FALSE,FALSE,FALSE," water hemlock, cowbane"," Diarrhea, seizures, tremors, extreme stomach pain, dilated pupils, fever, bloat, respiratory depression, and death.",https://www.aspca.org//pet-care/animal-poison-control/toxic-and-non-toxic-plants/poison-parsnip,https://www.aspca.org/sites/default/files/styles/medium_image_300x200/public/field/image/plants/cowbane-r.jpg?itok=hxJUs1SV
 Anacardiaceae, Toxicodendron species,Poison Sumac,TRUE,TRUE,TRUE," Similar: Poison Ivy, Poison Oak"," Allergic dermatitis in humans, usually not a problem in animals.",https://www.aspca.org//pet-care/animal-poison-control/toxic-and-non-toxic-plants/poison-sumac,https://www.aspca.org/sites/default/files/styles/medium_image_300x200/public/default_images/imageunavailable_0.jpg?itok=JCCt_uvE
 Acanthaceae, Hypoestes phyllostachya,Polka Dot Plant,TRUE,TRUE,TRUE," Pink Polka Dot Plant, Measles Plant, Baby’s Tears, Freckle Face"," Mild vomiting, diarrhea.",https://www.aspca.org//pet-care/animal-poison-control/toxic-and-non-toxic-plants/polka-dot-plant,https://www.aspca.org/sites/default/files/styles/medium_image_300x200/public/field/image/plants/babys-tears-r_0.jpg?itok=kXWLKbs7
 Polypodaceae, Cyrtomium falcatum,Polystichum Falcatum,TRUE,TRUE,FALSE, Fishtail Fern,null,https://www.aspca.org//pet-care/animal-poison-control/toxic-and-non-toxic-plants/polystichum-falcatum,https://www.aspca.org/sites/default/files/styles/medium_image_300x200/public/field/image/plants/fish-tail-fern-r.jpg?itok=8-9RC82C
 Pinaceae, Pinus ponderosa,Ponderosa Pine,FALSE,FALSE,FALSE," Blackjack Pine, Western Yellow Pine, Yellow Pine, Bull Pine", Cattle: premature birth of calves or miscarriage have been reported in cattle.,https://www.aspca.org//pet-care/animal-poison-control/toxic-and-non-toxic-plants/ponderosa-pine,https://www.aspca.org/sites/default/files/styles/medium_image_300x200/public/field/image/plants/ponderosa-pine-1-r.jpg?itok=itqNiOOp
 Agavaceae, Beaucarnea recurvata,Pony Tail,TRUE,TRUE,TRUE," Elephant-Foot Tree, Pony Tail Plant, Bottle Palm", ,https://www.aspca.org//pet-care/animal-poison-control/toxic-and-non-toxic-plants/pony-tail,https://www.aspca.org/sites/default/files/styles/medium_image_300x200/public/default_images/imageunavailable_0.jpg?itok=JCCt_uvE
 Asclepiadaceae, Hoya carnosa 'krinkle kurl',Porcelain Flower,TRUE,TRUE,FALSE, Hindu Rope Plant,null,https://www.aspca.org//pet-care/animal-poison-control/toxic-and-non-toxic-plants/porcelain-flower,https://www.aspca.org/sites/default/files/styles/medium_image_300x200/public/field/image/plants/hindu-rope-plant-r.jpg?itok=bE9P8V4i
 Portulacaceae, Portulaca oleracea,Portulaca,FALSE,FALSE,FALSE," Wild Portulaca, Rock Moss, Purslane, Pigwee, Pusley, Moss Rose"," Muscle weakness, depression, diarrhea",https://www.aspca.org//pet-care/animal-poison-control/toxic-and-non-toxic-plants/portulaca,https://www.aspca.org/sites/default/files/styles/medium_image_300x200/public/field/image/plants/moss-rose-r.jpg?itok=w2LbptFk
 Compositae, Calendula officinalis,Pot Marigold,TRUE,TRUE,FALSE," Marigold, Mary Bud, Gold bloom", ,https://www.aspca.org//pet-care/animal-poison-control/toxic-and-non-toxic-plants/pot-marigold,https://www.aspca.org/sites/default/files/styles/medium_image_300x200/public/default_images/imageunavailable_0.jpg?itok=JCCt_uvE
 Araceae, Epipremnum aureum,Pothos,FALSE,FALSE,FALSE," Golden Pothos, Devil's Ivy, Taro Vine, Ivy Arum"," Oral irritation, intense burning and irritation of mouth, tongue and lips, excessive drooling, vomiting, difficulty swallowing.",https://www.aspca.org//pet-care/animal-poison-control/toxic-and-non-toxic-plants/pothos,https://www.aspca.org/sites/default/files/styles/medium_image_300x200/public/devils-ivy-1-r.jpg?itok=PfK285jN
 Amaryllidaceae, Zephyranthes drummondii,Prairie Lily,TRUE,TRUE,FALSE," giant rain lily, hill country rain lily", ,https://www.aspca.org//pet-care/animal-poison-control/toxic-and-non-toxic-plants/prairie-lily,https://www.aspca.org/sites/default/files/styles/medium_image_300x200/public/default_images/imageunavailable_0.jpg?itok=JCCt_uvE
 , Abronia fragrans,Prairie Snowball,TRUE,TRUE,TRUE," sand verbena, wild lantana", ,https://www.aspca.org//pet-care/animal-poison-control/toxic-and-non-toxic-plants/prairie-snowball,https://www.aspca.org/sites/default/files/styles/medium_image_300x200/public/default_images/imageunavailable_0.jpg?itok=JCCt_uvE
 Leguminosae, Abrus precatorius,Prayer Bean,FALSE,FALSE,FALSE," Rosary Pea, Buddhist rosary bead, Indian Bead, Indian Licorice, Love Bean, Lucky Bean, Seminole Bead, Weather Plant"," Severe vomiting and diarrhea (sometimes bloody), tremors, high heart rate, fever, shock, death. Seeds are very toxic (seed coat must be broken).",https://www.aspca.org//pet-care/animal-poison-control/toxic-and-non-toxic-plants/prayer-bean,https://www.aspca.org/sites/default/files/styles/medium_image_300x200/public/field/image/plants/precatory-bean-r.jpg?itok=0TUt1pvz
 Marantaceae, Calathea insignis,Prayer Plant,TRUE,TRUE,FALSE, Maranta, ,https://www.aspca.org//pet-care/animal-poison-control/toxic-and-non-toxic-plants/prayer-plant,https://www.aspca.org/sites/default/files/styles/medium_image_300x200/public/default_images/imageunavailable_0.jpg?itok=JCCt_uvE
 Leguminosae, Abrus precatorius,Precatory Bean,FALSE,FALSE,FALSE," Rosary Pea, Buddhist rosary bead, Indian Bead, Indian Licorice, Love Bean, Lucky Bean, Seminole Bead, Weather Plant, Prayer Bean"," Severe vomiting and diarrhea (sometimes bloody), tremors, high heart rate, fever, shock, death. Seeds are very toxic (seed coat must be broken).",https://www.aspca.org//pet-care/animal-poison-control/toxic-and-non-toxic-plants/precatory-bean,https://www.aspca.org/sites/default/files/styles/medium_image_300x200/public/field/image/plants/precatory-bean-r.jpg?itok=0TUt1pvz
 Myrtaceae, Callistemon species,Prickly Bottlebrush,TRUE,TRUE,TRUE," Bottlebrush, Weeping Bottlebrush, Crimson Bottlebrush"," Do not confuse with Aesculus parviflora, a toxic Buckeye ""Bottlebrush"" plant containing Aesculin.",https://www.aspca.org//pet-care/animal-poison-control/toxic-and-non-toxic-plants/prickly-bottlebrush,https://www.aspca.org/sites/default/files/styles/medium_image_300x200/public/field/image/plants/weeping-bottlebrush-r.jpg?itok=nLg91Ylc
 Meliaceae, Melia azedarach,Pride-of-India,FALSE,FALSE,FALSE," China Ball Tree, Paradise Tree, Persian Lilac, White Cedar, Japanese Bead Tree, Texas Umbrella Tree, Bead Tree, Chinaberry Tree"," Diarrhea, vomiting, salivation, depression, weakness, and seizures. Ripe fruit (berries) most toxic but also bark, leaves, and flowers.",https://www.aspca.org//pet-care/animal-poison-control/toxic-and-non-toxic-plants/pride-india,https://www.aspca.org/sites/default/files/styles/medium_image_300x200/public/field/image/plants/bead-tree-r.jpg?itok=dQ4xzmpz
 Primulaceae, Primula vulgaris,Primrose,FALSE,FALSE,FALSE,null, Mild vomiting,https://www.aspca.org//pet-care/animal-poison-control/toxic-and-non-toxic-plants/primrose,https://www.aspca.org/sites/default/files/styles/medium_image_300x200/public/field/image/plants/primrose-r.jpg?itok=0yzdx0GU
 Oleaceae, Ligustrum japonicum,Privet,FALSE,FALSE,FALSE," amur, wax-leaf, common privet"," Gastrointestinal upset (most common), incoordination, increased heart rate, death (rare).",https://www.aspca.org//pet-care/animal-poison-control/toxic-and-non-toxic-plants/privet,https://www.aspca.org/sites/default/files/styles/medium_image_300x200/public/field/image/plants/common-privet-r.jpg?itok=BAP-H7J6
 Lamiaceae, Plectranthus oetendahlii,Prostrate Coleus,TRUE,TRUE,FALSE, , Non-toxic,https://www.aspca.org//pet-care/animal-poison-control/toxic-and-non-toxic-plants/prostrate-coleus,https://www.aspca.org/sites/default/files/styles/medium_image_300x200/public/default_images/imageunavailable_0.jpg?itok=JCCt_uvE
 Saliaceae, Salix purpurea,Pupleosier Willow,TRUE,TRUE,TRUE, , ,https://www.aspca.org//pet-care/animal-poison-control/toxic-and-non-toxic-plants/pupleosier-willow,https://www.aspca.org/sites/default/files/styles/medium_image_300x200/public/default_images/imageunavailable_0.jpg?itok=JCCt_uvE
 Aizoaceae, Frithia pulchra,Purple Baby Tears,TRUE,TRUE,FALSE, fairy elephant's feet, ,https://www.aspca.org//pet-care/animal-poison-control/toxic-and-non-toxic-plants/purple-baby-tears,https://www.aspca.org/sites/default/files/styles/medium_image_300x200/public/default_images/imageunavailable_0.jpg?itok=JCCt_uvE
 Asteraceae, Gynura aurantica,Purple Passion Vine,TRUE,TRUE,FALSE," Velvet Plant, Royal Velvet Plant, Purple Velvet Plant", Non-toxic,https://www.aspca.org//pet-care/animal-poison-control/toxic-and-non-toxic-plants/purple-passion-vine,https://www.aspca.org/sites/default/files/styles/medium_image_300x200/public/default_images/imageunavailable_0.jpg?itok=JCCt_uvE
 Asteraceae, Gynura aurantica,Purple Velvet Plant,TRUE,TRUE,FALSE," Velvet Plant, Royal Velvet Plant, Purple Passion Vine", Non-toxic,https://www.aspca.org//pet-care/animal-poison-control/toxic-and-non-toxic-plants/purple-velvet-plant,https://www.aspca.org/sites/default/files/styles/medium_image_300x200/public/default_images/imageunavailable_0.jpg?itok=JCCt_uvE
 Acanthaceae, Hemigraphis exotica,Purple Waffle Plant,TRUE,TRUE,FALSE, waffle plant, ,https://www.aspca.org//pet-care/animal-poison-control/toxic-and-non-toxic-plants/purple-waffle-plant,https://www.aspca.org/sites/default/files/styles/medium_image_300x200/public/default_images/imageunavailable_0.jpg?itok=JCCt_uvE
 Portulacaceae, Portulaca oleracea,Purslane,FALSE,FALSE,FALSE," Wild Portulaca, Rock Moss, Portulaca, Pigwee, Pusley, Moss Rose", ,https://www.aspca.org//pet-care/animal-poison-control/toxic-and-non-toxic-plants/purslane,https://www.aspca.org/sites/default/files/styles/medium_image_300x200/public/default_images/imageunavailable_0.jpg?itok=JCCt_uvE
 Liliaceae, Clintonia uniflora,Queencup,TRUE,TRUE,FALSE, Bride's Bonnet,null,https://www.aspca.org//pet-care/animal-poison-control/toxic-and-non-toxic-plants/queencup,https://www.aspca.org/sites/default/files/styles/medium_image_300x200/public/field/image/plants/queencup-r.jpg?itok=J8GFye8C
 Commelinaceae, Dichorisandra reginae,Queens Spiderwort,TRUE,TRUE,FALSE, , ,https://www.aspca.org//pet-care/animal-poison-control/toxic-and-non-toxic-plants/queens-spiderwort,https://www.aspca.org/sites/default/files/styles/medium_image_300x200/public/default_images/imageunavailable_0.jpg?itok=JCCt_uvE
 Cannaceae, Canna edulis,Queensland Arrowroot,TRUE,TRUE,TRUE," Achira, Canna, Arrowroot",null,https://www.aspca.org//pet-care/animal-poison-control/toxic-and-non-toxic-plants/queensland-arrowroot,https://www.aspca.org/sites/default/files/styles/medium_image_300x200/public/field/image/plants/achira-r.jpg?itok=iQMC4kSf
 Proteaceae, Macadamia integrifolia,Queensland Nut,FALSE,FALSE,FALSE," Macadamia Nut, Australia Nut"," Dogs: depression, weakness (especially of rear limbs), vomiting, tremors.",https://www.aspca.org//pet-care/animal-poison-control/toxic-and-non-toxic-plants/queensland-nut,https://www.aspca.org/sites/default/files/styles/medium_image_300x200/public/field/image/plants/macadamia-nut-r.jpg?itok=NzjVmw5J
 Polypodiaceae, Davallia spp.,Rabbits Foot Fern,TRUE,TRUE,FALSE," Hare Fern, Squirrel Foot Fern, Deer Foot Fern, Ball Fern", ,https://www.aspca.org//pet-care/animal-poison-control/toxic-and-non-toxic-plants/rabbits-foot-fern,https://www.aspca.org/sites/default/files/styles/medium_image_300x200/public/default_images/imageunavailable_0.jpg?itok=JCCt_uvE
 Liliaceae, Asparagus densiflorus cv sprengeri,Racemose asparagus,FALSE,FALSE,FALSE," Asparagus, Emerald Feather, Emerald Fern, Sprengeri Fern, Plumosa Fern, Lace Fern, Asparagus Fern, Shatavari"," allergic dermatitis with repeated dermal exposure. Berry ingestion could result in gastric upset (vomiting, abdominal pain, or diarrhea.)",https://www.aspca.org//pet-care/animal-poison-control/toxic-and-non-toxic-plants/racemose-asparagus,https://www.aspca.org/sites/default/files/styles/medium_image_300x200/public/field/image/plants/asparagus-fern-r.jpg?itok=t-jWcv3E
 Compositae, Senecio species,Ragwort,FALSE,FALSE,FALSE," Golden Ragwort, Tansy"," The plant is not very palatable, but will be eaten by animals with no other forage; poisonings typically occur from ingestion of green plant material or material in hay. The toxic components can cause liver failure, referred to as ""walking disease"" or ""sleepy staggers"". Signs include weight loss, weakness, sleepiness, yawning, incoordination, yellowish discoloration to mucous membranes (icterus), neurologic problems secondary to liver failure (aimless walking, chewing motions, head pressing). Animals may appear to be normal at first, then become suddenly affected; the syndrome progresses rapidly over a few days to a week. Liver damage, depression, anorexia, vomiting, diarrhea, muddy mucous membranes, weakness, ataxia.",https://www.aspca.org//pet-care/animal-poison-control/toxic-and-non-toxic-plants/ragwort,https://www.aspca.org/sites/default/files/styles/medium_image_300x200/public/field/image/plants/ragwort-r.jpg?itok=k8xM44JR
 Orchidaceae, Epidendrum prismatocarpum,Rainbow Orchid,TRUE,TRUE,FALSE,null,null,https://www.aspca.org//pet-care/animal-poison-control/toxic-and-non-toxic-plants/rainbow-orchid,https://www.aspca.org/sites/default/files/styles/medium_image_300x200/public/field/image/plants/rainbow-orchid-r.jpg?itok=3FAQFNh3
 Apiaceae, Sphenosciadium capitellatum,Ranger's Button,FALSE,FALSE,FALSE, White Heads," Photosensitization (ulcerative and exudative dermatitis), ocular toxicity.",https://www.aspca.org//pet-care/animal-poison-control/toxic-and-non-toxic-plants/rangers-button,https://www.aspca.org/sites/default/files/styles/medium_image_300x200/public/field/image/plants/rangers-button-r.jpg?itok=FA3uxT4U
 Papilionaceae, Crotalaria albida,Rattlebox,FALSE,FALSE,FALSE,null," The plant is not very palatable, but will be eaten by animals with no other forage; poisonings typically occur from ingestion of green plant material or material in hay. The toxic components can cause liver failure, referred to as ""walking disease"" or ""sleepy staggers"". Signs include weight loss, weakness, sleepiness, yawning, incoordination, yellowish discoloration to mucous membranes (icterus), neurologic problems secondary to liver failure (aimless walking, chewing motions, head pressing). Animals may appear to be normal at first, then become suddenly affected; the syndrome progresses rapidly over a few days to a week.",https://www.aspca.org//pet-care/animal-poison-control/toxic-and-non-toxic-plants/rattlebox,https://www.aspca.org/sites/default/files/styles/medium_image_300x200/public/field/image/plants/rattlebox-r.jpg?itok=ujDQjuHa
 Asteraceae, Haplopappus heterophyllus,Rayless Goldenrod,FALSE,FALSE,FALSE,null," Plant is toxic year round, although poisonings typically occur in summer and late fall. Horses eating one to ten percent of their body weight in the plant can develop lethal clinical effects. Onset of signs generally occurs after two days to three weeks, and includes incoordination, muscle weakness and tremors, elevated heart rate, cardiac arrhythmias, fluid accumulation and swelling of the nervous system, profuse sweating, inability to swallow.",https://www.aspca.org//pet-care/animal-poison-control/toxic-and-non-toxic-plants/rayless-goldenrod,https://www.aspca.org/sites/default/files/styles/medium_image_300x200/public/field/image/plants/rayless-goldenrod-r.jpg?itok=WjXUKM9T
 Gesneriaceae, Episcia reptans,Red African Violet,TRUE,TRUE,FALSE, Flame African Violet, ,https://www.aspca.org//pet-care/animal-poison-control/toxic-and-non-toxic-plants/red-african-violet,https://www.aspca.org/sites/default/files/styles/medium_image_300x200/public/default_images/imageunavailable_0.jpg?itok=JCCt_uvE
 Liliaceae, Smilax walteria,Red Berried Greenbrier,TRUE,TRUE,TRUE, red-berried-bamboo," Vomiting, diarrhea and depression. Leaves and berries are low toxicity.",https://www.aspca.org//pet-care/animal-poison-control/toxic-and-non-toxic-plants/red-berried-greenbrier,https://www.aspca.org/sites/default/files/styles/medium_image_300x200/public/default_images/imageunavailable_0.jpg?itok=JCCt_uvE
 Piperaceae, Peperomia clusiifolia,Red Edge Peperomia,TRUE,TRUE,FALSE, , ,https://www.aspca.org//pet-care/animal-poison-control/toxic-and-non-toxic-plants/red-edge-peperomia,https://www.aspca.org/sites/default/files/styles/medium_image_300x200/public/default_images/imageunavailable_0.jpg?itok=JCCt_uvE
 Araceae, Philodendron bipennifolium,Red Emerald,FALSE,FALSE,FALSE," Horsehead Philodendron, Cordatum, Heartleaf Philodendron, Panda Plant, Split Leaf Philodendron, Fruit Salad Plant, Fiddle Leaf, Red Princess, Saddle Leaf"," Oral irritation, intense burning and irritation of mouth, tongue and lips, excessive drooling, vomiting, difficulty swallowing.",https://www.aspca.org//pet-care/animal-poison-control/toxic-and-non-toxic-plants/red-emerald,https://www.aspca.org/sites/default/files/styles/medium_image_300x200/public/default_images/imageunavailable_0.jpg?itok=JCCt_uvE
 Rosaceae, Crataegus species,Red Hawthorne,TRUE,TRUE,TRUE," Haws, Pirliteiro", ,https://www.aspca.org//pet-care/animal-poison-control/toxic-and-non-toxic-plants/red-hawthorne,https://www.aspca.org/sites/default/files/styles/medium_image_300x200/public/default_images/imageunavailable_0.jpg?itok=JCCt_uvE
 Liliaceae, Lilium umbellatum,Red Lily,FALSE,TRUE,TRUE,null," Vomiting, inappetence, lethargy, kidney failure, and death is possible. Cats are only species known to be affected.",https://www.aspca.org//pet-care/animal-poison-control/toxic-and-non-toxic-plants/red-lily,https://www.aspca.org/sites/default/files/styles/medium_image_300x200/public/field/image/plants/red-lily-r.jpg?itok=Yj85Pnl_
 Aceraceae, Acer rubrum,Red Maple,FALSE,FALSE,FALSE," Swamp Maple, Scarlet Maple, Curled Maple, Soft Maple"," Wilted leaves are considered to be most toxic. Damage to red blood cells, resulting in decreased ability to carry oxygen to tissues; darkening of the membranes around the eyes/mouth,weakness, feed refusal, central nervous system depression, abdominal discomfort, laminitis, discolored urine, abortion in pregnant mares. Death can occur within 18 hours or as long as 7-10 days after ingestion. Most cases of poisoning are reported during midsummer through early winter.",https://www.aspca.org//pet-care/animal-poison-control/toxic-and-non-toxic-plants/red-maple,https://www.aspca.org/sites/default/files/styles/medium_image_300x200/public/field/image/plants/red-maple-swamp-maple-r.jpg?itok=0gmrSo75
 Agavaceae, Cordyline rubra,Red Palm Lily,TRUE,TRUE,FALSE, red frutied palm lily, ,https://www.aspca.org//pet-care/animal-poison-control/toxic-and-non-toxic-plants/red-palm-lily,https://www.aspca.org/sites/default/files/styles/medium_image_300x200/public/default_images/imageunavailable_0.jpg?itok=JCCt_uvE
 Araceae, Philodendron bipennifolium,Red Princess,FALSE,FALSE,FALSE," Horsehead Philodendron, Cordatum, Heartleaf Philodendron, Panda Plant, Split Leaf Philodendron, Fruit Salad Plant, Fiddle Leaf, Red Emerald, Saddle Leaf"," Oral irritation, intense burning and irritation of mouth, tongue and lips, excessive drooling, vomiting, difficulty swallowing.",https://www.aspca.org//pet-care/animal-poison-control/toxic-and-non-toxic-plants/red-princess,https://www.aspca.org/sites/default/files/styles/medium_image_300x200/public/default_images/imageunavailable_0.jpg?itok=JCCt_uvE
 Marantaceae, Calathea insignis,Red Veined Prayer,TRUE,TRUE,FALSE," Maranta, Prayer Plant", ,https://www.aspca.org//pet-care/animal-poison-control/toxic-and-non-toxic-plants/red-veined-prayer,https://www.aspca.org/sites/default/files/styles/medium_image_300x200/public/default_images/imageunavailable_0.jpg?itok=JCCt_uvE
 Agavaceae, Dracaena marginata,Red-Marginated Dracaena,FALSE,FALSE,FALSE, straight-marginated dracaena," In cats: dilated pupils, abdominal pain, increased heartrate and drooling. In both cats and dogs: vomiting, depression, inappetence, drooling, incoordination, and weakness.",https://www.aspca.org//pet-care/animal-poison-control/toxic-and-non-toxic-plants/red-marginated-dracaena,https://www.aspca.org/sites/default/files/styles/medium_image_300x200/public/field/image/plants/red-margined-dracaena-r.jpg?itok=FOLQQnFx
 Palmae, Chamaedorea elegans,Reed Palm,TRUE,TRUE,FALSE," Bamboo palm, Miniature Fish Tail Dwarf Palm, Parlor Palm, Good Luck Palm",null,https://www.aspca.org//pet-care/animal-poison-control/toxic-and-non-toxic-plants/reed-palm,https://www.aspca.org/sites/default/files/styles/medium_image_300x200/public/field/image/plants/good-luck-palm-r.jpg?itok=ntv9y8-g
 Zingiberaceae, Kaempferia,Resurrection Lily,TRUE,TRUE,TRUE," Peacock Ginger, Kaempferia", ,https://www.aspca.org//pet-care/animal-poison-control/toxic-and-non-toxic-plants/resurrection-lily,https://www.aspca.org/sites/default/files/styles/medium_image_300x200/public/default_images/imageunavailable_0.jpg?itok=JCCt_uvE
 Begoniaceae, Begonia rex,Rex Begonia,TRUE,TRUE,FALSE, , ,https://www.aspca.org//pet-care/animal-poison-control/toxic-and-non-toxic-plants/rex-begonia,https://www.aspca.org/sites/default/files/styles/medium_image_300x200/public/default_images/imageunavailable_0.jpg?itok=JCCt_uvE
 Ericaceae, Rhododendron spp,Rhododendron,FALSE,FALSE,FALSE," Rosebay, Azalea"," Vomiting, diarrhea, hypersalivation, weakness, coma, hypotension, CNS depression, cardiovascular collapse and death. Ingestion of a few leaves can cause serious problems. Rhododendron is typically not very palatable to horses unless it is the only forage available, but sheep and goats may graze readily on the plant. The toxic principle interferes with normal skeletal muscle, cardiac muscle and nerve function. Clinical effects typically occur within a few hours after ingestion, and can include acute digestive upset, excessive drooling, loss of appetite, frequent bowel movements/diarrhea, colic, depression, weakness, loss of coordination, stupor, leg paralysis, weak heart rate and recumbency for 2 or more days; at this point, improvement may be seen or the animal may become comatose and die.",https://www.aspca.org//pet-care/animal-poison-control/toxic-and-non-toxic-plants/rhododendron,https://www.aspca.org/sites/default/files/styles/medium_image_300x200/public/field/image/plants/rhododendron-rosebay-2-r.jpg?itok=5-7GKqkw
 Polygonaceae, Rheum rhabarbarium,Rhubarb,FALSE,FALSE,FALSE, Pie Plant," Kidney failure, tremors, salivation.",https://www.aspca.org//pet-care/animal-poison-control/toxic-and-non-toxic-plants/rhubarb,https://www.aspca.org/sites/default/files/styles/medium_image_300x200/public/field/image/plants/rhubarb-r.jpg?itok=hVIwd-mu
 Pipericeae, Peperomia obtusifolia,Rhynchophorum,TRUE,TRUE,FALSE," Pepper Face, Baby Rubber Plant, American Rubber Plant", ,https://www.aspca.org//pet-care/animal-poison-control/toxic-and-non-toxic-plants/rhynchophorum,https://www.aspca.org/sites/default/files/styles/medium_image_300x200/public/default_images/imageunavailable_0.jpg?itok=JCCt_uvE
 Agavaceae, Dracaena spp.,Ribbon Plant,FALSE,FALSE,FALSE," Corn Plant, Cornstalk Plant, Dracaena, Dragon Tree"," Vomiting (occasionally with blood), depression, anorexia, hypersalivation, dilated pupils (cats).",https://www.aspca.org//pet-care/animal-poison-control/toxic-and-non-toxic-plants/ribbon-plant,https://www.aspca.org/sites/default/files/styles/medium_image_300x200/public/default_images/imageunavailable_0.jpg?itok=JCCt_uvE
 Liliaceae, Chlorophytum comosum,Ribbon Plant (Chlorophytum Comosum),TRUE,TRUE,FALSE," anthericum, walking anthericum, spider ivy, spider plant", ,https://www.aspca.org//pet-care/animal-poison-control/toxic-and-non-toxic-plants/ribbon-plant-chlorophytum-comosum,https://www.aspca.org/sites/default/files/styles/medium_image_300x200/public/default_images/imageunavailable_0.jpg?itok=JCCt_uvE
