family,scientific_name,name,non_toxicity_cats,non_toxicity_dogs,non_toxicity_horses,additional_common_names,clinical_signs,url,image_url
 Cannaceae, Canna edulis,Achira,TRUE,TRUE,TRUE," Canna, Arrowroot",null,https://www.aspca.org//pet-care/animal-poison-control/toxic-and-non-toxic-plants/achira,https://www.aspca.org/sites/default/files/styles/medium_image_300x200/public/field/image/plants/achira-r.jpg?itok=iQMC4kSf
 Cucurbitaceae, Cucurbita pepo,Acorn Squash,TRUE,TRUE,TRUE," Similar plants:pumpkin, zucchini",null,https://www.aspca.org//pet-care/animal-poison-control/toxic-and-non-toxic-plants/acorn-squash,https://www.aspca.org/sites/default/files/styles/medium_image_300x200/public/field/image/plants/acorn-squash-r.jpg?itok=t1Jia-vp
 Araceae, Arum maculatum,Adam-and-Eve,FALSE,FALSE,FALSE," Arum, Lord-and-Ladies, Wake Robin, Starch Root, Bobbins, Cuckoo Plant"," Oral irritation, intense burning and irritation of mouth, tongue and lips, excessive drooling, vomiting, difficulty swallowing",https://www.aspca.org//pet-care/animal-poison-control/toxic-and-non-toxic-plants/adam-and-eve,https://www.aspca.org/sites/default/files/styles/medium_image_300x200/public/field/image/plants/arum-r.jpg?itok=I6KyQVcY
 Compositae, Gerbera jamesonii,African Daisy,TRUE,TRUE,TRUE," Barberton Daisy, Veldt Daisy, Transvaal Daisy, Gerber Daisy",null,https://www.aspca.org//pet-care/animal-poison-control/toxic-and-non-toxic-plants/african-daisy,https://www.aspca.org/sites/default/files/styles/medium_image_300x200/public/field/image/plants/african-daisy-r.jpg?itok=Q30Femx_
 Gesneriaceae, Saintpaulia spp.,African Violet,TRUE,TRUE,TRUE, Cape Marigold, ,https://www.aspca.org//pet-care/animal-poison-control/toxic-and-non-toxic-plants/african-violet,https://www.aspca.org/sites/default/files/styles/medium_image_300x200/public/default_images/imageunavailable_0.jpg?itok=JCCt_uvE
null, Ricinus communis,African Wonder Tree,FALSE,FALSE,FALSE,null," Access to ornamental plants or pruned foliage most common in poisonings. Ricin is a highly toxic component that inhibits protein synthesis; ingestion of as little as one ounce of seeds can be lethal. Signs typically develop 12 to 48 hours after ingestion, and include loss of appetite, excessive thirst, weakness, colic, trembling, sweating, loss of coordination, difficulty breathing, progressive central nervous system depression, and fever. As syndrome progresses, bloody diarrhea may occur, and convulsions and coma can precede death.",https://www.aspca.org//pet-care/animal-poison-control/toxic-and-non-toxic-plants/african-wonder-tree,https://www.aspca.org/sites/default/files/styles/medium_image_300x200/public/african-wonder-2-r.jpg?itok=omLSnmZc
 Mimosaceae, Prosopis limensis,Algaroba,TRUE,TRUE,TRUE," Kiawe, Mesquite", ,https://www.aspca.org//pet-care/animal-poison-control/toxic-and-non-toxic-plants/algaroba,https://www.aspca.org/sites/default/files/styles/medium_image_300x200/public/default_images/imageunavailable_0.jpg?itok=JCCt_uvE
 Araceae, Alocasia spp.,Alocasia,FALSE,FALSE,FALSE, Elephant's Ear," Oral irritation, intense burning and irritation of mouth tongue and lips, excessive drooling, vomiting, difficulty swallowing",https://www.aspca.org//pet-care/animal-poison-control/toxic-and-non-toxic-plants/alocasia,https://www.aspca.org/sites/default/files/styles/medium_image_300x200/public/field/image/plants/alocasia-r.jpg?itok=Q-8fgzUQ
 Liliaceae, Aloe vera,Aloe,FALSE,FALSE,FALSE,null," Vomiting, depression, diarrhea, anorexia, tremors, change in urine color.",https://www.aspca.org//pet-care/animal-poison-control/toxic-and-non-toxic-plants/aloe,https://www.aspca.org/sites/default/files/styles/medium_image_300x200/public/field/image/plants/aloe-r.jpg?itok=w3kaGLt-
 Leguminosae, Trifolium hybridum,Alsike Clover,FALSE,FALSE,FALSE,null," Two distinct syndromes are associated with poisoning. The first is called ""dew poisoning"", and is associated with a photosensitivity reaction: sunburn on nonpigmented skin. Affected areas become painful and form ulcerations, and inflammation/ulceration of the mouth and tongue may also occur along with colic and diarrhea, depression or excitation. The second syndrome is associated with recurring bouts of a condition known as ""big liver disease""; animals develop a yellowish discoloration of membranes around the mouth, eyes and nonpigmented areas of skin, accompanied by weight loss, central nervous system depression, loss of appetite, incoordination, dark, discolored urine and a greatly enlarged, fibrotic liver.",https://www.aspca.org//pet-care/animal-poison-control/toxic-and-non-toxic-plants/alsike-clover,https://www.aspca.org/sites/default/files/styles/medium_image_300x200/public/field/image/plants/alsike-clover-r.jpg?itok=w7VcLRAD
 Urticaceae, Pilea cadieri,Aluminum Plant,TRUE,TRUE,FALSE, Watermelon Plant, ,https://www.aspca.org//pet-care/animal-poison-control/toxic-and-non-toxic-plants/aluminum-plant,https://www.aspca.org/sites/default/files/styles/medium_image_300x200/public/default_images/imageunavailable_0.jpg?itok=JCCt_uvE
 Saxifragaceae, Heuchera sanguinea,Alumroot,TRUE,TRUE,TRUE," Coral Bells, Heuchera", ,https://www.aspca.org//pet-care/animal-poison-control/toxic-and-non-toxic-plants/alumroot,https://www.aspca.org/sites/default/files/styles/medium_image_300x200/public/default_images/imageunavailable_0.jpg?itok=JCCt_uvE
 Brassicaceae, Alyssum spp.,Alyssum,TRUE,TRUE,TRUE, Alyssum varieties, ,https://www.aspca.org//pet-care/animal-poison-control/toxic-and-non-toxic-plants/alyssum,https://www.aspca.org/sites/default/files/styles/medium_image_300x200/public/default_images/imageunavailable_0.jpg?itok=JCCt_uvE
 Amaryllidaceae, Amaryllis sp.,Amaryllis,FALSE,FALSE,FALSE," Many, including: Belladonna lily, Saint Joseph lily, Cape Belladonna, Naked Lady"," vomiting, depression, diarrhea, abdominal pain, hypersalivation, anorexia, tremors.",https://www.aspca.org//pet-care/animal-poison-control/toxic-and-non-toxic-plants/amaryllis,https://www.aspca.org/sites/default/files/styles/medium_image_300x200/public/field/image/plants/amaryllis-r.jpg?itok=thn_q8Y5
 Chenopodiaceae, Chenopodium botrys,Ambrosia Mexicana,FALSE,FALSE,FALSE," Jerusalem Oak, Feather Geranium"," Vomiting, anorexia, depression",https://www.aspca.org//pet-care/animal-poison-control/toxic-and-non-toxic-plants/ambrosia-mexicana,https://www.aspca.org/sites/default/files/styles/medium_image_300x200/public/field/image/plants/ambrosia-mexicana-r.jpg?itok=Mqy9Lq0f
 Celastraceae, Celastrus scandens,American Bittersweet,FALSE,FALSE,FALSE," Bittersweet, Waxwork, Shrubby Bittersweet, False Bittersweet, Climbing Bittersweet"," weakness, convulsions, gastroenteritis (vomiting, diarrhea)",https://www.aspca.org//pet-care/animal-poison-control/toxic-and-non-toxic-plants/american-bittersweet,https://www.aspca.org/sites/default/files/styles/medium_image_300x200/public/field/image/plants/american-bittersweet-r.jpg?itok=K-7x7p2u
 Aquifoliaceae, Ilex opaca,American Holly,FALSE,FALSE,FALSE," English Holly, European Holly, Oregon Holly, Inkberry, Winterberry"," Vomiting, diarrhea and depression. Leaves and berries are low toxicity.",https://www.aspca.org//pet-care/animal-poison-control/toxic-and-non-toxic-plants/american-holly,https://www.aspca.org/sites/default/files/styles/medium_image_300x200/public/field/image/plants/english-holly-r.jpg?itok=5hjEx9q-
 Berberidaceae, Podophyllum peltatum,American Mandrake,FALSE,FALSE,FALSE," Mayapple, Indian Apple Root, Umbrella Leaf, Wild Lemon, Hog Apple, Duck's Foot, Raccoonberry"," Vomiting, diarrhea, lethargy, panting, coma (rare); dermal - redness, skin ulcers.",https://www.aspca.org//pet-care/animal-poison-control/toxic-and-non-toxic-plants/american-mandrake,https://www.aspca.org/sites/default/files/styles/medium_image_300x200/public/field/image/plants/americanmandrake.jpg?itok=-Bvmbwve
 Berberidaceae, Podophyllum peltatum,American Mandrake,FALSE,FALSE,FALSE," Mayapple, Indian Apple Root, Umbrella Leaf, Wild Lemon, Hog Apple, Duck's Foot, Raccoonberry"," Vomiting, diarrhea, lethargy, panting, coma (rare); dermal – redness, skin ulcers.",https://www.aspca.org//content/plant/american-mandrake,https://www.aspca.org/sites/default/files/styles/medium_image_300x200/public/field/image/plants/americanmandrake.jpg?itok=-Bvmbwve
 Pipericeae, Peperomia obtusifolia,American Rubber Plant,TRUE,TRUE,FALSE," Pepper Face, Baby Rubber Plant", ,https://www.aspca.org//pet-care/animal-poison-control/toxic-and-non-toxic-plants/american-rubber-plant,https://www.aspca.org/sites/default/files/styles/medium_image_300x200/public/default_images/imageunavailable_0.jpg?itok=JCCt_uvE
 Taxaceae, Taxus canidensus,American Yew,FALSE,FALSE,FALSE,null," Tremors, difficulty breathing, vomiting, seizures (dogs), sudden death from acute heart failure.",https://www.aspca.org//pet-care/animal-poison-control/toxic-and-non-toxic-plants/american-yew,https://www.aspca.org/sites/default/files/styles/medium_image_300x200/public/field/image/plants/japanese-yew-r.jpg?itok=xoes_oCs
 Aceraceae, Acer ginnala,Amur Maple,TRUE,TRUE,FALSE," Maple, Amur",null,https://www.aspca.org//pet-care/animal-poison-control/toxic-and-non-toxic-plants/amur-maple,https://www.aspca.org/sites/default/files/styles/medium_image_300x200/public/field/image/plants/amur-maple-r.jpg?itok=hvqPOTm8
 Ericaceae, Pieris japonica,Andromeda Japonica,FALSE,FALSE,FALSE," Pieris, Lily-of-the-Valley Bush"," Vomiting, diarrhea, depression, cardiovascular collapse, hypersalivation, weakness, coma, low blood pressure, cardiovascular collapse and death. Ingestion of a few leaves can cause serious problems.",https://www.aspca.org//pet-care/animal-poison-control/toxic-and-non-toxic-plants/andromeda-japonica,https://www.aspca.org/sites/default/files/styles/medium_image_300x200/public/field/image/plants/pieris-1-r.jpg?itok=X6pqkm6x
 Araliaceae, Aralia spinosa,Angelica Tree,FALSE,FALSE,FALSE," Hercules' Club, Devil's Walking Stick, Prickly Ash, Prickly Elder"," Skin and oral irritation, hypersalivation, vomiting, diarrhea",https://www.aspca.org//pet-care/animal-poison-control/toxic-and-non-toxic-plants/angelica-tree,https://www.aspca.org/sites/default/files/styles/medium_image_300x200/public/field/image/plants/angelica-tree-r.jpg?itok=wC1hxI6W
 Liliaceae, Chlorophytum comosum,Anthericum Comosum,TRUE,TRUE,FALSE," Ribbon Plant, Spider Plant, Spider Ivy", ,https://www.aspca.org//pet-care/animal-poison-control/toxic-and-non-toxic-plants/anthericum-comosum,https://www.aspca.org/sites/default/files/styles/medium_image_300x200/public/default_images/imageunavailable_0.jpg?itok=JCCt_uvE
 Scrophulariaceae, Antirrhinum multiflorum,Antirrhinum Multiflorum,TRUE,TRUE,TRUE, Withered Snapdragon, ,https://www.aspca.org//pet-care/animal-poison-control/toxic-and-non-toxic-plants/antirrhinum-multiflorum,https://www.aspca.org/sites/default/files/styles/medium_image_300x200/public/default_images/imageunavailable_0.jpg?itok=JCCt_uvE
 Scrophulariaceae, Antirrhinum glandulosum,Antirrhinum Multiflorum,TRUE,TRUE,TRUE, Withered Snapdragon, ,https://www.aspca.org//pet-care/animal-poison-control/toxic-and-non-toxic-plants/antirrhinum-multiflorum-0,https://www.aspca.org/sites/default/files/styles/medium_image_300x200/public/default_images/imageunavailable_0.jpg?itok=JCCt_uvE
 Rosaceae, Malus sylvestrus,Apple,FALSE,FALSE,FALSE, Includes crabapples," Stems, leaves, seeds contain cyanide, particularly toxic in the process of wilting: brick red mucous membranes, dilated pupils, difficulty breathing, panting, shock.",https://www.aspca.org//pet-care/animal-poison-control/toxic-and-non-toxic-plants/apple,https://www.aspca.org/sites/default/files/styles/medium_image_300x200/public/field/image/plants/apple-r.jpg?itok=Fvvtk3yj
 Rosaceae, Prunus armeniaca,Apricot,FALSE,FALSE,FALSE," Group also includes Plum, Peach, Cherry"," Stems, leaves, seeds contain cyanide, particularly toxic in the process of wilting: brick red mucous membranes, dilated pupils, difficulty breathing, panting, shock.",https://www.aspca.org//pet-care/animal-poison-control/toxic-and-non-toxic-plants/apricot,https://www.aspca.org/sites/default/files/styles/medium_image_300x200/public/field/image/plants/apricot-r.jpg?itok=0DhmVE42
 , Exacum affine,Arabian Gentian,TRUE,TRUE,FALSE," Persian Violet, German Violet", ,https://www.aspca.org//pet-care/animal-poison-control/toxic-and-non-toxic-plants/arabian-gentian,https://www.aspca.org/sites/default/files/styles/medium_image_300x200/public/default_images/imageunavailable_0.jpg?itok=JCCt_uvE
 Palmae, Dypsis lutescens,Areca Palm,TRUE,TRUE,FALSE," Golden Butterfly Palm, Cane Palm, Golden Feather Palm, Yellow Palm",null,https://www.aspca.org//pet-care/animal-poison-control/toxic-and-non-toxic-plants/areca-palm,https://www.aspca.org/sites/default/files/styles/medium_image_300x200/public/field/image/plants/imageunavailable_0.jpg?itok=Vvd3ZEQt
 Bromiliaceae, Neoregalia spp.,Aregelia,TRUE,TRUE,FALSE," Crimson cup, Marbled fingernail,Blushing bromeliad, Ossifragi Vase, Miniature Marble plant", ,https://www.aspca.org//pet-care/animal-poison-control/toxic-and-non-toxic-plants/aregelia,https://www.aspca.org/sites/default/files/styles/medium_image_300x200/public/default_images/imageunavailable_0.jpg?itok=JCCt_uvE
 Araceae, Syngonium podophyllum,Arrow-Head Vine,FALSE,FALSE,FALSE," Nephthytis, Green Gold Naphthysis, African Evergreen, Trileaf Wonder"," Oral irritation, intense burning and irritation of mouth, tongue and lips, excessive drooling, vomiting, difficulty swallowing.",https://www.aspca.org//pet-care/animal-poison-control/toxic-and-non-toxic-plants/arrow-head-vine,https://www.aspca.org/sites/default/files/styles/medium_image_300x200/public/field/image/plants/arrow-head-vine-r.jpg?itok=JRFWHUqt
 Urticaceae, Pilea microphylla,Artillery Plant,TRUE,TRUE,TRUE, , ,https://www.aspca.org//pet-care/animal-poison-control/toxic-and-non-toxic-plants/artillery-plant,https://www.aspca.org/sites/default/files/styles/medium_image_300x200/public/default_images/imageunavailable_0.jpg?itok=JCCt_uvE
 Araceae, Arum maculatum,Arum,FALSE,FALSE,FALSE," Cuckoo-pint, Lord-and-Ladies, Adam-and-Eve, Starch Root, Bobbins, Wake Robin"," Oral irritation, intense burning and irritation of mouth, tongue and lips, excessive drooling, vomiting, difficulty swallowing",https://www.aspca.org//pet-care/animal-poison-control/toxic-and-non-toxic-plants/arum,https://www.aspca.org/sites/default/files/styles/medium_image_300x200/public/field/image/plants/arum-r.jpg?itok=I6KyQVcY
 Araceae, Zantedeschia aethiopica,Arum Lily,FALSE,FALSE,FALSE," Calla Lily, Pig Lily, White Arum, Trumpet Lily, Florist's Calla, Garden Calla"," Oral irritation, intense burning and irritation of mouth, tongue and lips, excessive drooling, vomiting, difficulty swallowing",https://www.aspca.org//pet-care/animal-poison-control/toxic-and-non-toxic-plants/arum-lily,https://www.aspca.org/sites/default/files/styles/medium_image_300x200/public/field/image/plants/arum-lily-r.jpg?itok=G6nxjK_3
 Liliaceae, Lilium asiatica,Asian Lily,FALSE,FALSE,FALSE, Asiatic Lily," Vomiting, inappetence, lethargy, kidney failure, and death is possible. Cats are only species known to be affected.",https://www.aspca.org//pet-care/animal-poison-control/toxic-and-non-toxic-plants/asian-lily,https://www.aspca.org/sites/default/files/styles/medium_image_300x200/public/asian-lily-2-r.jpg?itok=3SJiXqMp
 Liliaceae, Asparagus densiflorus cv sprengeri,Asparagus Fern,FALSE,FALSE,FALSE," Asparagus, Emerald Feather, Emerald Fern, Sprengeri Fern, Plumosa Fern, Lace Fern, Racemose Asparagus, Shatavari"," allergic dermatitis with repeated dermal exposure. Berry ingestion could result in gastric upset (vomiting, abdominal pain, or diarrhea.)",https://www.aspca.org//pet-care/animal-poison-control/toxic-and-non-toxic-plants/asparagus-fern,https://www.aspca.org/sites/default/files/styles/medium_image_300x200/public/field/image/plants/asparagus-fern-r.jpg?itok=t-jWcv3E
 Polypodiaceae, Cyrtomium falcatum,Aspidium falcatum,TRUE,TRUE,FALSE," Fern Holly, Japanese Holly, Fish Tail",null,https://www.aspca.org//pet-care/animal-poison-control/toxic-and-non-toxic-plants/aspidium-falcatum,https://www.aspca.org/sites/default/files/styles/medium_image_300x200/public/field/image/plants/fish-tail-fern-r.jpg?itok=8-9RC82C
 Araliaceae, Brassaia actinophylla,Australian Ivy Palm,FALSE,FALSE,FALSE," Schefflera, Umbrella Tree, Octopus Tree, Starleaf"," While this plant does contain potentially toxic substances, the most common effects seen are mild vomiting and diarrhea.",https://www.aspca.org//pet-care/animal-poison-control/toxic-and-non-toxic-plants/australian-ivy-palm,https://www.aspca.org/sites/default/files/styles/medium_image_300x200/public/field/image/plants/australian-ivy-palm-r.jpg?itok=3sh4iprI
 Proteaceae, Macadamia integrifolia,Australian Nut,FALSE,FALSE,FALSE," Macadamia Nut, Queensland Nut"," Depression, hyperthermia, weakness, muscular stiffness, vomiting, tremors, increased heartrate. Only reported in dogs at this time.",https://www.aspca.org//pet-care/animal-poison-control/toxic-and-non-toxic-plants/australian-nut,https://www.aspca.org/sites/default/files/styles/medium_image_300x200/public/field/image/plants/macadamia-nut-r.jpg?itok=NzjVmw5J
 Araucariaceae, Araucaria heterophylla,Australian Pine,FALSE,FALSE,FALSE," Norfolk Pine, House Pine, Norfolk Island Pine"," Vomiting, depression",https://www.aspca.org//pet-care/animal-poison-control/toxic-and-non-toxic-plants/australian-pine,https://www.aspca.org/sites/default/files/styles/medium_image_300x200/public/australian-pine-r.jpg?itok=xSD4jAE8
 Liliaceae, Colchicum autumnale,Autumn Crocus,FALSE,FALSE,FALSE, Meadow Saffron," oral irritation, bloody vomiting, diarrhea, shock, multi-organ damage, bone marrow suppression.",https://www.aspca.org//pet-care/animal-poison-control/toxic-and-non-toxic-plants/autumn-crocus,https://www.aspca.org/sites/default/files/styles/medium_image_300x200/public/field/image/plants/autumn-crocus-r.jpg?itok=SJgRHkFo
 Elaeagnaceae, Elaeagnus sp.,Autumn Olive,TRUE,TRUE,TRUE," Silver Berry, Russian Olive",null,https://www.aspca.org//pet-care/animal-poison-control/toxic-and-non-toxic-plants/autumn-olive,https://www.aspca.org/sites/default/files/styles/medium_image_300x200/public/field/image/plants/autumn-olive-r.jpg?itok=kRuEC1ji
 Lauraceae, Persea americana,Avocado,FALSE,FALSE,FALSE, Alligator Pear," Birds, rabbits, and some large animals are especially sensitive to avocados, as they can have respiratory distress, congestion, fluid accumulation around the heart, and even death from consuming avocado. While avocado is toxic to some animals, in dogs and cats, we do not expect to see serious signs of illness. In some dogs and cats, mild stomach upset may occur if the animal eats a significant amount of avocado flesh or peel. Ingestion of the pit can lead to obstruction in the gastrointestinal tract, which is a serious situation requiring urgent veterinary care. Avocado is sometimes included in pet foods for nutritional benefit. We would generally not expect avocado meal or oil present in commercial pet foods to pose a hazard to dogs and cats. ",https://www.aspca.org//pet-care/animal-poison-control/toxic-and-non-toxic-plants/avocado,https://www.aspca.org/sites/default/files/styles/medium_image_300x200/public/field/image/plants/avocado-r.jpg?itok=JZ7A0-5H
 Ericaceae, Rhododendron spp,Azalea,FALSE,FALSE,FALSE," Rosebay, Rhododendron"," Vomiting, diarrhea, hypersalivation, weakness, coma, hypotension, CNS depression, cardiovascular collapse and death. Ingestion of a few leaves can cause serious problems. Rhododendron is typically not very palatable to horses unless it is the only forage available, but sheep and goats may graze readily on the plant. The toxic principle interferes with normal skeletal muscle, cardiac muscle and nerve function. Clinical effects typically occur within a few hours after ingestion, and can include acute digestive upset, excessive drooling, loss of appetite, frequent bowel movements/diarrhea, colic, depression, weakness, loss of coordination, stupor, leg paralysis, weak heart rate and recumbency for 2 or more days; at this point, improvement may be seen or the animal may become comatose and die.",https://www.aspca.org//pet-care/animal-poison-control/toxic-and-non-toxic-plants/azalea,https://www.aspca.org/sites/default/files/styles/medium_image_300x200/public/field/image/plants/azalea-r.jpg?itok=450nK4pc
 Agavaceae, Cordyline terminalis,Baby Doll Ti Plant,FALSE,FALSE,FALSE," Ti-Plant, Good-Luck Plant, Hawaiian Ti Plant"," Vomiting (occasionally with blood), depression, anorexia, hypersalivation, dilated pupils (cats)",https://www.aspca.org//pet-care/animal-poison-control/toxic-and-non-toxic-plants/baby-doll-ti-plant,https://www.aspca.org/sites/default/files/styles/medium_image_300x200/public/field/image/plants/baby-doll-ti-plant-r.jpg?itok=Il2S0xKa
 Pipericeae, Peperomia obtusifolia,Baby Rubber Plant,TRUE,TRUE,FALSE," Pepper Face, American Rubber Plant", ,https://www.aspca.org//pet-care/animal-poison-control/toxic-and-non-toxic-plants/baby-rubber-plant,https://www.aspca.org/sites/default/files/styles/medium_image_300x200/public/default_images/imageunavailable_0.jpg?itok=JCCt_uvE
 Caryophyllaceae, Gypsophila elegans,Baby’s Breath,FALSE,FALSE,FALSE, Maidens Breath," Vomiting, diarrhea",https://www.aspca.org//pet-care/animal-poison-control/toxic-and-non-toxic-plants/babys-breath,https://www.aspca.org/sites/default/files/styles/medium_image_300x200/public/field/image/plants/babys-breath-r.jpg?itok=J37CJPSz
 Acanthaceae, Hypoestes phyllostachya,Baby’s Tears,TRUE,TRUE,TRUE," Polka Dot Plant, Measles Plant, Flamingo Plant, Freckle Face, Pink Splash"," Mild vomiting, diarrhea",https://www.aspca.org//pet-care/animal-poison-control/toxic-and-non-toxic-plants/babys-tears,https://www.aspca.org/sites/default/files/styles/medium_image_300x200/public/field/image/plants/babys-tears-r.jpg?itok=gKVHYRc3
 Asteraceae, Centaurea cyanus,Bachelors Buttons,TRUE,TRUE,FALSE," Cornflower, Bluebottle",null,https://www.aspca.org//pet-care/animal-poison-control/toxic-and-non-toxic-plants/bachelors-buttons,https://www.aspca.org/sites/default/files/styles/medium_image_300x200/public/field/image/plants/bluebottle-r.jpg?itok=T2L82S-S
 Polypodiaceae, Davallia spp.,Ball Fern,TRUE,TRUE,FALSE," Rabbit's Foot Fern, Squirrel Foot Fern, Deer Foot Fern, Hare Fern", ,https://www.aspca.org//pet-care/animal-poison-control/toxic-and-non-toxic-plants/ball-fern,https://www.aspca.org/sites/default/files/styles/medium_image_300x200/public/default_images/imageunavailable_0.jpg?itok=JCCt_uvE
 Gramineae, Phyllostachys aurea,Bamboo,TRUE,TRUE,TRUE," Golden Bamboo, Fishpole Bamboo", ,https://www.aspca.org//pet-care/animal-poison-control/toxic-and-non-toxic-plants/bamboo,https://www.aspca.org/sites/default/files/styles/medium_image_300x200/public/default_images/imageunavailable_0.jpg?itok=JCCt_uvE
 Palmae, Chamaedorea elegans,Bamboo Palm,TRUE,TRUE,FALSE," Miniature Fish Tail Dwarf Palm, Parlor Palm, Good Luck Palm",null,https://www.aspca.org//pet-care/animal-poison-control/toxic-and-non-toxic-plants/bamboo-palm,https://www.aspca.org/sites/default/files/styles/medium_image_300x200/public/field/image/plants/good-luck-palm-r.jpg?itok=ntv9y8-g
 Liliaceae, Smilax laurifolia,Bamboo Vine,TRUE,TRUE,TRUE," Blaspheme vine, Laurel-leaved Greenbrier",null,https://www.aspca.org//pet-care/animal-poison-control/toxic-and-non-toxic-plants/bamboo-vine,https://www.aspca.org/sites/default/files/styles/medium_image_300x200/public/field/image/plants/blaspheme-vine-r.jpg?itok=iutJYeCr
 Musaceae, Musa acuminata,Banana,TRUE,TRUE,TRUE, Plantain,null,https://www.aspca.org//pet-care/animal-poison-control/toxic-and-non-toxic-plants/banana,https://www.aspca.org/sites/default/files/styles/medium_image_300x200/public/field/image/plants/banana-r.jpg?itok=EVDCwEtU
 Cucurbitaceae, Cucurbita maxima var. banana,Banana Squash,TRUE,TRUE,TRUE, , ,https://www.aspca.org//pet-care/animal-poison-control/toxic-and-non-toxic-plants/banana-squash,https://www.aspca.org/sites/default/files/styles/medium_image_300x200/public/default_images/imageunavailable_0.jpg?itok=JCCt_uvE
 Aloaceae, Aloe barbadensis,Barbados Aloe,FALSE,FALSE,FALSE," Medicine Plant, True Aloe"," Vomiting, change in urine color (red)",https://www.aspca.org//pet-care/animal-poison-control/toxic-and-non-toxic-plants/barbados-aloe,https://www.aspca.org/sites/default/files/styles/medium_image_300x200/public/field/image/plants/barbados-aloe-r.jpg?itok=VNt_q1pv
 Amaryllidaceae, Hippeastrum spp.,Barbados Lily,FALSE,FALSE,FALSE," Amaryllis, Fire Lily, Lily of the Palace, Ridderstjerne"," Vomiting, salvation, diarrhea; large ingestions cause convulsions, low blood pressure, tremors and cardiac arrhythmias. Bulbs are the most poisonous part.",https://www.aspca.org//pet-care/animal-poison-control/toxic-and-non-toxic-plants/barbados-lily,https://www.aspca.org/sites/default/files/styles/medium_image_300x200/public/field/image/plants/barbados-lily-r.jpg?itok=SVpwywsB
null, Caesalpinia pulcherrima,Barbados Pride,FALSE,FALSE,FALSE," Peacock Flower, Dwarf Poinciana", Vomiting and diarrhea.,https://www.aspca.org//pet-care/animal-poison-control/toxic-and-non-toxic-plants/barbados-pride,https://www.aspca.org/sites/default/files/styles/medium_image_300x200/public/field/image/plants/peacock-flower-r.jpg?itok=XCQhK1ED
